{
  "patent": {
    "publication_no": "CN222727908U",
    "country_code": "CN",
    "title": "前舱储物结构、前舱结构及车辆",
    "applicants": [
      "比亚迪股份有限公司",
      "济南比亚迪汽车有限公司"
    ],
    "inventors": [
      "吴宝成",
      "王若丞",
      "牟晓龙"
    ],
    "application_date": "2024-07-03",
    "google_patents_url": "https://patents.google.com/patent/CN222727908U/zh",
    "pdf_url": "https://patentimages.storage.googleapis.com/0a/e5/13/a3e78e9c371f66/CN222727908U.pdf"
  },
  "claims": [
    {
      "claim_no": 1,
      "claim_text": "1.一种前舱储物结构，设置于车辆的车身和前机盖之间，其特征在于，所述前舱储物结构包括本体，所述本体的内部形成储物空间，所述本体具有位于顶端的第一开口以及位于侧壁上的至少一个第二开口，所述第一开口和所述至少一个第二开口相贯通以共同形成与所述储物空间连通的取放口。",
      "features": [
        {
          "feature_id": "C1-F1",
          "feature_text": "一种前舱储物结构，设置于车辆的车身和前机盖之间"
        },
        {
          "feature_id": "C1-F2",
          "feature_text": "所述前舱储物结构包括本体"
        },
        {
          "feature_id": "C1-F3",
          "feature_text": "所述本体的内部形成储物空间"
        },
        {
          "feature_id": "C1-F4",
          "feature_text": "所述本体具有位于顶端的第一开口以及位于侧壁上的至少一个第二开口"
        },
        {
          "feature_id": "C1-F5",
          "feature_text": "所述第一开口和所述至少一个第二开口相贯通以共同形成与所述储物空间连通的取放口"
        }
      ]
    },
    {
      "claim_no": 2,
      "claim_text": "2.根据权利要求1所述的前舱储物结构，其特征在于，所述本体具有对应于车辆的前后方向的前侧壁和后侧壁，所述至少一个第二开口位于所述前侧壁上。",
      "features": [
        {
          "feature_id": "C2-F1",
          "feature_text": "所述本体具有对应于车辆的前后方向的前侧壁和后侧壁，所述至少一个第二开口位于所述前侧壁上"
        }
      ]
    },
    {
      "claim_no": 3,
      "claim_text": "3.根据权利要求2所述的前舱储物结构，其特征在于，所述前舱储物结构包括设置在所述储物空间内的第一平台，所述第一平台与所述本体的前侧壁相邻布置。",
      "features": [
        {
          "feature_id": "C3-F1",
          "feature_text": "所述前舱储物结构包括设置在所述储物空间内的第一平台，所述第一平台与所述本体的前侧壁相邻布置"
        }
      ]
    },
    {
      "claim_no": 4,
      "claim_text": "4.根据权利要求3所述的前舱储物结构，其特征在于，所述第一平台的高度小于或等于所述第二开口的底边的高度。",
      "features": [
        {
          "feature_id": "C4-F1",
          "feature_text": "所述第一平台的高度小于或等于所述第二开口的底边的高度"
        }
      ]
    },
    {
      "claim_no": 5,
      "claim_text": "5.根据权利要求3所述的前舱储物结构，其特征在于，所述本体具有沿车辆的宽度方向相对的左侧壁和右侧壁，所述左侧壁和所述右侧壁各自相邻布置有第二平台，以能够可选择地在所述第二平台上搭接隔物件而将所述储物空间分隔为位于所述隔物件下方的第一空间和位于所述隔物件上方的第二空间。",
      "features": [
        {
          "feature_id": "C5-F1",
          "feature_text": "所述本体具有沿车辆的宽度方向相对的左侧壁和右侧壁，所述左侧壁和所述右侧壁各自相邻布置有第二平台，以能够可选择地在所述第二平台上搭接隔物件而将所述储物空间分隔为位于所述隔物件下方的第一空间和位于所述隔物件上方的第二空间"
        }
      ]
    },
    {
      "claim_no": 6,
      "claim_text": "6.根据权利要求5所述的前舱储物结构，其特征在于，所述第一平台和所述第二平台相对于所述本体的底壁的高度相同。",
      "features": [
        {
          "feature_id": "C6-F1",
          "feature_text": "所述第一平台和所述第二平台相对于所述本体的底壁的高度相同"
        }
      ]
    },
    {
      "claim_no": 7,
      "claim_text": "7.根据权利要求1-6中任意一项所述的前舱储物结构，其特征在于，所述本体的侧壁设置有连通所述车身的维修口，所述维修口可开启地连接有维修口盖。",
      "features": [
        {
          "feature_id": "C7-F1",
          "feature_text": "所述本体的侧壁设置有连通所述车身的维修口，所述维修口可开启地连接有维修口盖"
        }
      ]
    },
    {
      "claim_no": 8,
      "claim_text": "8.一种前舱结构，其特征在于，包括前机盖、驱动件以及权利要求1-7中任意一项所述的前舱储物结构，所述前机盖铰接于所述车身，所述驱动件用于驱动所述前机盖转动，以遮盖所述取放口或避让所述取放口。",
      "features": [
        {
          "feature_id": "C8-F1",
          "feature_text": "一种前舱结构"
        },
        {
          "feature_id": "C8-F2",
          "feature_text": "包括前机盖、驱动件以及权利要求1-7中任意一项所述的前舱储物结构"
        },
        {
          "feature_id": "C8-F3",
          "feature_text": "所述前机盖铰接于所述车身"
        },
        {
          "feature_id": "C8-F4",
          "feature_text": "所述驱动件用于驱动所述前机盖转动，以遮盖所述取放口或避让所述取放口"
        }
      ]
    },
    {
      "claim_no": 9,
      "claim_text": "9.根据权利要求8所述的前舱结构，其特征在于，所述驱动件的数量设置为至少两个，至少两个所述驱动件分别位于所述前舱储物结构的沿所述车辆的宽度方向的相对两侧。",
      "features": [
        {
          "feature_id": "C9-F1",
          "feature_text": "所述驱动件的数量设置为至少两个，至少两个所述驱动件分别位于所述前舱储物结构的沿所述车辆的宽度方向的相对两侧"
        }
      ]
    },
    {
      "claim_no": 10,
      "claim_text": "10.根据权利要求8或9所述的前舱结构，其特征在于，所述驱动件包括分别连接于所述前机盖和所述车身的电动撑杆。",
      "features": [
        {
          "feature_id": "C10-F1",
          "feature_text": "所述驱动件包括分别连接于所述前机盖和所述车身的电动撑杆"
        }
      ]
    },
    {
      "claim_no": 11,
      "claim_text": "11.根据权利要求8所述的前舱结构，其特征在于，所述前舱结构还包括连接于所述前机盖的格栅，所述格栅用于至少部分地封闭所述第二开口。",
      "features": [
        {
          "feature_id": "C11-F1",
          "feature_text": "所述前舱结构还包括连接于所述前机盖的格栅，所述格栅用于至少部分地封闭所述第二开口"
        }
      ]
    },
    {
      "claim_no": 12,
      "claim_text": "12.根据权利要求8所述的前舱结构，其特征在于，所述前舱结构还包括沿所述车辆的宽度方向间隔布置的左饰板和右饰板，以及沿所述车辆的前后方向间隔布置的通风盖板和前端模块，所述前舱储物结构位于所述左饰板、所述右饰板、所述通风盖板和所述前端模块之间，所述第二开口与所述前端模块相邻布置。",
      "features": [
        {
          "feature_id": "C12-F1",
          "feature_text": "所述前舱结构还包括沿所述车辆的宽度方向间隔布置的左饰板和右饰板，以及沿所述车辆的前后方向间隔布置的通风盖板和前端模块，所述前舱储物结构位于所述左饰板、所述右饰板、所述通风盖板和所述前端模块之间，所述第二开口与所述前端模块相邻布置"
        }
      ]
    },
    {
      "claim_no": 13,
      "claim_text": "13.根据权利要求12所述的前舱结构，其特征在于，所述前端模块包括骨架以及连接于所述骨架的机舱锁，所述本体具有搭接在所述骨架上的翻边，所述翻边上设置有与所述机舱锁位置相对的检修口，所述检修口处可拆卸地连接有检修口盖。",
      "features": [
        {
          "feature_id": "C13-F1",
          "feature_text": "所述前端模块包括骨架以及连接于所述骨架的机舱锁，所述本体具有搭接在所述骨架上的翻边，所述翻边上设置有与所述机舱锁位置相对的检修口，所述检修口处可拆卸地连接有检修口盖"
        }
      ]
    },
    {
      "claim_no": 14,
      "claim_text": "14.根据权利要求8所述的前舱结构，其特征在于，所述前机盖与所述前舱储物结构之间设置有围绕所述取放口布置的密封条。",
      "features": [
        {
          "feature_id": "C14-F1",
          "feature_text": "所述前机盖与所述前舱储物结构之间设置有围绕所述取放口布置的密封条"
        }
      ]
    },
    {
      "claim_no": 15,
      "claim_text": "15.根据权利要求8所述的前舱结构，其特征在于，所述前机盖上设置有隔热层。",
      "features": [
        {
          "feature_id": "C15-F1",
          "feature_text": "所述前机盖上设置有隔热层"
        }
      ]
    },
    {
      "claim_no": 16,
      "claim_text": "16.一种车辆，其特征在于，包括：车身；权利要求8-15中任意一项所述的前舱结构，所述前机盖通过机舱锁可解锁地锁止于所述车身。",
      "features": [
        {
          "feature_id": "C16-F1",
          "feature_text": "一种车辆"
        },
        {
          "feature_id": "C16-F2",
          "feature_text": "包括：车身；权利要求8-15中任意一项所述的前舱结构"
        },
        {
          "feature_id": "C16-F3",
          "feature_text": "所述前机盖通过机舱锁可解锁地锁止于所述车身"
        }
      ]
    },
    {
      "claim_no": 17,
      "claim_text": "17.根据权利要求16所述的车辆，其特征在于，所述车辆包括控制单元，所述控制单元分别与所述机舱锁、所述驱动件信号连接。",
      "features": [
        {
          "feature_id": "C17-F1",
          "feature_text": "所述车辆包括控制单元，所述控制单元分别与所述机舱锁、所述驱动件信号连接"
        }
      ]
    },
    {
      "claim_no": 18,
      "claim_text": "18.根据权利要求17所述的车辆，其特征在于，所述控制单元包括控制器和多媒体单元，所述多媒体单元包括信号连接的多媒体主机和多媒体显示屏，所述控制器分别与所述机舱锁、所述驱动件和所述多媒体主机信号连接。",
      "features": [
        {
          "feature_id": "C18-F1",
          "feature_text": "所述控制单元包括控制器和多媒体单元，所述多媒体单元包括信号连接的多媒体主机和多媒体显示屏，所述控制器分别与所述机舱锁、所述驱动件和所述多媒体主机信号连接"
        }
      ]
    },
    {
      "claim_no": 19,
      "claim_text": "19.根据权利要求18所述的车辆，其特征在于，所述多媒体单元还包括与所述多媒体主机信号连接的天线模块，所述天线模块用于信号连接于移动终端。",
      "features": [
        {
          "feature_id": "C19-F1",
          "feature_text": "所述多媒体单元还包括与所述多媒体主机信号连接的天线模块，所述天线模块用于信号连接于移动终端"
        }
      ]
    },
    {
      "claim_no": 20,
      "claim_text": "20.根据权利要求18所述的车辆，其特征在于，所述控制单元包括与所述控制器信号连接的微动开关，所述微动开关设置在所述前机盖和/或所述车身上。",
      "features": [
        {
          "feature_id": "C20-F1",
          "feature_text": "所述控制单元包括与所述控制器信号连接的微动开关，所述微动开关设置在所述前机盖和/或所述车身上"
        }
      ]
    },
    {
      "claim_no": 21,
      "claim_text": "21.根据权利要求18所述的车辆，其特征在于，所述车辆还包括整车控制器，所述控制器为域控制器，所述域控制器信号连接于所述整车控制器。",
      "features": [
        {
          "feature_id": "C21-F1",
          "feature_text": "所述车辆还包括整车控制器，所述控制器为域控制器，所述域控制器信号连接于所述整车控制器"
        }
      ]
    }
  ],
  "claim_1_text": "1.一种前舱储物结构，设置于车辆的车身和前机盖之间，其特征在于，所述前舱储物结构包括本体，所述本体的内部形成储物空间，所述本体具有位于顶端的第一开口以及位于侧壁上的至少一个第二开口，所述第一开口和所述至少一个第二开口相贯通以共同形成与所述储物空间连通的取放口。",
  "claim_1_features": [
    {
      "feature_id": "C1-F1",
      "feature_text": "一种前舱储物结构，设置于车辆的车身和前机盖之间"
    },
    {
      "feature_id": "C1-F2",
      "feature_text": "所述前舱储物结构包括本体"
    },
    {
      "feature_id": "C1-F3",
      "feature_text": "所述本体的内部形成储物空间"
    },
    {
      "feature_id": "C1-F4",
      "feature_text": "所述本体具有位于顶端的第一开口以及位于侧壁上的至少一个第二开口"
    },
    {
      "feature_id": "C1-F5",
      "feature_text": "所述第一开口和所述至少一个第二开口相贯通以共同形成与所述储物空间连通的取放口"
    }
  ],
  "technology_tag": "车身与底盘",
  "claims_source": "html"
}
