{
  "patent": {
    "publication_no": "CN116201423B",
    "country_code": "CN",
    "title": "车门外把手、车门总成和车辆",
    "applicants": [
      "比亚迪股份有限公司"
    ],
    "inventors": [
      "罗忠良",
      "蒋旭耀",
      "张小强",
      "李明"
    ],
    "application_date": "2021-11-30",
    "google_patents_url": "https://patents.google.com/patent/CN116201423B/zh"
  },
  "claims": [
    {
      "claim_no": 1,
      "claim_text": "1.一种车门外把手，其特征在于，包括：底座，所述底座设有扣手槽且适于安装于车门；把手柄，所述把手柄在关闭位置和打开位置之间可转动地安装于所述底座，所述把手柄处于所述关闭位置时，所述把手柄的外表面不凸出于所述车门的外表面且封盖所述扣手槽，所述把手柄通过向所述扣手槽内转动而从所述关闭位置转动至所述打开位置时，所述把手柄不凸出于所述车门的外表面且露出所述扣手槽；驱动装置，所述驱动装置适于与车门锁相连且与所述把手柄连接，所述驱动装置在所述车门锁解锁时将所述把手柄驱动至位于所述打开位置和所述关闭位置之间的中间位置，所述把手柄处于所述中间位置时将所述扣手槽完全露出。",
      "features": [
        {
          "feature_id": "C1-F1",
          "feature_text": "一种车门外把手"
        },
        {
          "feature_id": "C1-F2",
          "feature_text": "底座，所述底座设有扣手槽且适于安装于车门"
        },
        {
          "feature_id": "C1-F3",
          "feature_text": "把手柄，所述把手柄在关闭位置和打开位置之间可转动地安装于所述底座，所述把手柄处于所述关闭位置时，所述把手柄的外表面不凸出于所述车门的外表面且封盖所述扣手槽，所述把手柄通过向所述扣手槽内转动而从所述关闭位置转动至所述打开位置时，所述把手柄不凸出于所述车门的外表面且露出所述扣手槽"
        },
        {
          "feature_id": "C1-F4",
          "feature_text": "驱动装置，所述驱动装置适于与车门锁相连且与所述把手柄连接，所述驱动装置在所述车门锁解锁时将所述把手柄驱动至位于所述打开位置和所述关闭位置之间的中间位置，所述把手柄处于所述中间位置时将所述扣手槽完全露出"
        }
      ]
    },
    {
      "claim_no": 2,
      "claim_text": "2.根据权利要求1所述的车门外把手，其特征在于，所述把手柄处于所述关闭位置时，所述把手柄的外表面与所述车门的外表面平齐。",
      "features": [
        {
          "feature_id": "C2-F1",
          "feature_text": "所述把手柄处于所述关闭位置时，所述把手柄的外表面与所述车门的外表面平齐"
        }
      ]
    },
    {
      "claim_no": 3,
      "claim_text": "3.根据权利要求1所述的车门外把手，其特征在于，所述车门封盖所述扣手槽的一部分，所述把手柄处于所述关闭位置时封盖所述扣手槽的另一部分，所述把手柄处于所述打开位置时在所述车门内止抵于所述车门的封盖所述扣手槽的部分。",
      "features": [
        {
          "feature_id": "C3-F1",
          "feature_text": "所述车门封盖所述扣手槽的一部分，所述把手柄处于所述关闭位置时封盖所述扣手槽的另一部分，所述把手柄处于所述打开位置时在所述车门内止抵于所述车门的封盖所述扣手槽的部分"
        }
      ]
    },
    {
      "claim_no": 4,
      "claim_text": "4.根据权利要求1所述的车门外把手，其特征在于，所述把手柄设有转轴，所述把手柄通过所述转轴可转动地安装于所述底座，所述转轴位于所述把手柄处于所述关闭位置时的下沿处。",
      "features": [
        {
          "feature_id": "C4-F1",
          "feature_text": "所述把手柄设有转轴，所述把手柄通过所述转轴可转动地安装于所述底座，所述转轴位于所述把手柄处于所述关闭位置时的下沿处"
        }
      ]
    },
    {
      "claim_no": 5,
      "claim_text": "5.根据权利要求1所述的车门外把手，其特征在于，所述把手柄从所述关闭位置通过向所述扣手槽内转动110°~120°而转动至所述中间位置；所述把手柄从所述中间位置通过向所述扣手槽内转动50°~60°而转动至所述打开位置。",
      "features": [
        {
          "feature_id": "C5-F1",
          "feature_text": "所述把手柄从所述关闭位置通过向所述扣手槽内转动110°~120°而转动至所述中间位置"
        },
        {
          "feature_id": "C5-F2",
          "feature_text": "所述把手柄从所述中间位置通过向所述扣手槽内转动50°~60°而转动至所述打开位置"
        }
      ]
    },
    {
      "claim_no": 6,
      "claim_text": "6.根据权利要求1所述的车门外把手，其特征在于，所述驱动装置为电机，所述电机安装于所述底座外，所述电机与所述把手柄传动连接且适于所述车门锁通讯。",
      "features": [
        {
          "feature_id": "C6-F1",
          "feature_text": "所述驱动装置为电机，所述电机安装于所述底座外，所述电机与所述把手柄传动连接且适于所述车门锁通讯"
        }
      ]
    },
    {
      "claim_no": 7,
      "claim_text": "7.根据权利要求1所述的车门外把手，其特征在于，所述驱动装置包括：推杆，所述推杆的一端适于与所述车门锁传动连接；解锁摇臂，所述解锁摇臂与所述把手柄传动连接且通过解锁推杆卡扣与所述推杆的另一端相连。",
      "features": [
        {
          "feature_id": "C7-F1",
          "feature_text": "推杆，所述推杆的一端适于与所述车门锁传动连接"
        },
        {
          "feature_id": "C7-F2",
          "feature_text": "解锁摇臂，所述解锁摇臂与所述把手柄传动连接且通过解锁推杆卡扣与所述推杆的另一端相连"
        }
      ]
    },
    {
      "claim_no": 8,
      "claim_text": "8.一种车门总成，其特征在于，包括：车门；根据权利要求1-7中任一项所述的车门外把手。",
      "features": [
        {
          "feature_id": "C8-F1",
          "feature_text": "一种车门总成"
        },
        {
          "feature_id": "C8-F2",
          "feature_text": "车门"
        },
        {
          "feature_id": "C8-F3",
          "feature_text": "车门外把手"
        }
      ]
    },
    {
      "claim_no": 9,
      "claim_text": "9.根据权利要求8所述的车门总成，其特征在于，所述车门包括：车门外板和车门内板，所述车门外板安装于所述车门内板的外侧，所述底座安装于所述车门外板且位于所述车门外板和所述车门内板之间，所述车门外板设有与所述扣手槽位置对应的把手开口。",
      "features": [
        {
          "feature_id": "C9-F1",
          "feature_text": "所述车门包括：车门外板和车门内板，所述车门外板安装于所述车门内板的外侧，所述底座安装于所述车门外板且位于所述车门外板和所述车门内板之间，所述车门外板设有与所述扣手槽位置对应的把手开口"
        }
      ]
    },
    {
      "claim_no": 10,
      "claim_text": "10.根据权利要求9所述的车门总成，其特征在于，所述车门外板的朝向所述车门内板的一侧设有沿上下方向间隔设置的第一定位凸起和第二定位凸起，所述底座设有第一固定耳和第二固定耳，所述底座位于所述第一定位凸起和所述第二定位凸起之间，所述第一固定耳固定于所述第一定位凸起的朝向所述车门内板的一侧，所述第二固定耳固定于所述第二定位凸起的朝向所述车门内板的一侧。",
      "features": [
        {
          "feature_id": "C10-F1",
          "feature_text": "所述车门外板的朝向所述车门内板的一侧设有沿上下方向间隔设置的第一定位凸起和第二定位凸起"
        },
        {
          "feature_id": "C10-F2",
          "feature_text": "所述底座设有第一固定耳和第二固定耳，所述底座位于所述第一定位凸起和所述第二定位凸起之间，所述第一固定耳固定于所述第一定位凸起的朝向所述车门内板的一侧，所述第二固定耳固定于所述第二定位凸起的朝向所述车门内板的一侧"
        }
      ]
    },
    {
      "claim_no": 11,
      "claim_text": "11.一种车辆，其特征在于，包括根据权利要求8-10中任一项所述的车门总成。",
      "features": [
        {
          "feature_id": "C11-F1",
          "feature_text": "一种车辆"
        },
        {
          "feature_id": "C11-F2",
          "feature_text": "车门总成"
        }
      ]
    }
  ],
  "claim_1_text": "1.一种车门外把手，其特征在于，包括：底座，所述底座设有扣手槽且适于安装于车门；把手柄，所述把手柄在关闭位置和打开位置之间可转动地安装于所述底座，所述把手柄处于所述关闭位置时，所述把手柄的外表面不凸出于所述车门的外表面且封盖所述扣手槽，所述把手柄通过向所述扣手槽内转动而从所述关闭位置转动至所述打开位置时，所述把手柄不凸出于所述车门的外表面且露出所述扣手槽；驱动装置，所述驱动装置适于与车门锁相连且与所述把手柄连接，所述驱动装置在所述车门锁解锁时将所述把手柄驱动至位于所述打开位置和所述关闭位置之间的中间位置，所述把手柄处于所述中间位置时将所述扣手槽完全露出。",
  "claim_1_features": [
    {
      "feature_id": "C1-F1",
      "feature_text": "一种车门外把手"
    },
    {
      "feature_id": "C1-F2",
      "feature_text": "底座，所述底座设有扣手槽且适于安装于车门"
    },
    {
      "feature_id": "C1-F3",
      "feature_text": "把手柄，所述把手柄在关闭位置和打开位置之间可转动地安装于所述底座，所述把手柄处于所述关闭位置时，所述把手柄的外表面不凸出于所述车门的外表面且封盖所述扣手槽，所述把手柄通过向所述扣手槽内转动而从所述关闭位置转动至所述打开位置时，所述把手柄不凸出于所述车门的外表面且露出所述扣手槽"
    },
    {
      "feature_id": "C1-F4",
      "feature_text": "驱动装置，所述驱动装置适于与车门锁相连且与所述把手柄连接，所述驱动装置在所述车门锁解锁时将所述把手柄驱动至位于所述打开位置和所述关闭位置之间的中间位置，所述把手柄处于所述中间位置时将所述扣手槽完全露出"
    }
  ],
  "technology_tag": "车身与底盘",
  "claims_source": "html"
}
