{
  "patent": {
    "publication_no": "CN223014515U",
    "country_code": "CN",
    "title": "车载显示设备及车辆",
    "applicants": [
      "比亚迪股份有限公司"
    ],
    "inventors": [
      "黄付田",
      "钟燕军",
      "吴天宇",
      "岑俊辉",
      "谢明"
    ],
    "application_date": "2024-08-29",
    "google_patents_url": "https://patents.google.com/patent/CN223014515U/zh",
    "pdf_url": "https://patentimages.storage.googleapis.com/8c/4d/b3/223eed81f9fd3f/CN223014515U.pdf"
  },
  "claims": [
    {
      "claim_no": 1,
      "claim_text": "1.一种车载显示设备，其特征在于，包括：显示器；第一驱动机构，与所述显示器连接，用于驱动所述显示器转动；第二驱动机构，与所述显示器连接，用于驱动所述显示器及所述第一驱动机构作直线运动。",
      "features": [
        {
          "feature_id": "C1-F1",
          "feature_text": "一种车载显示设备"
        },
        {
          "feature_id": "C1-F2",
          "feature_text": "显示器"
        },
        {
          "feature_id": "C1-F3",
          "feature_text": "第一驱动机构，与所述显示器连接，用于驱动所述显示器转动"
        },
        {
          "feature_id": "C1-F4",
          "feature_text": "第二驱动机构，与所述显示器连接，用于驱动所述显示器及所述第一驱动机构作直线运动"
        }
      ]
    },
    {
      "claim_no": 2,
      "claim_text": "2.根据权利要求1所述的车载显示设备，其特征在于，所述第二驱动机构包括相互连接的第二驱动件及第二驱动部，所述第二驱动部被配置为在所述第二驱动件的作用下沿第一方向作直线运动，所述第二驱动部在第二方向的至少一端构造有连接部，所述显示器构造有安装孔，所述连接部转动连接于所述安装孔内，其中，所述第一方向与所述第二方向呈角度设置。",
      "features": [
        {
          "feature_id": "C2-F1",
          "feature_text": "所述第二驱动机构包括相互连接的第二驱动件及第二驱动部，所述第二驱动部被配置为在所述第二驱动件的作用下沿第一方向作直线运动"
        },
        {
          "feature_id": "C2-F2",
          "feature_text": "所述第二驱动部在第二方向的至少一端构造有连接部，所述显示器构造有安装孔，所述连接部转动连接于所述安装孔内"
        },
        {
          "feature_id": "C2-F3",
          "feature_text": "所述第一方向与所述第二方向呈角度设置"
        }
      ]
    },
    {
      "claim_no": 3,
      "claim_text": "3.根据权利要求2所述的车载显示设备，其特征在于，所述第二驱动部包括驱动杆及推杆，所述驱动杆的一端与所述第二驱动件连接，另一端与所述推杆连接，所述连接部构造于所述推杆。",
      "features": [
        {
          "feature_id": "C3-F1",
          "feature_text": "所述第二驱动部包括驱动杆及推杆，所述驱动杆的一端与所述第二驱动件连接，另一端与所述推杆连接，所述连接部构造于所述推杆"
        }
      ]
    },
    {
      "claim_no": 4,
      "claim_text": "4.根据权利要求3所述的车载显示设备，其特征在于，所述推杆上构造有安装槽，所述驱动杆远离所述第二驱动件的一端设于所述安装槽内，并通过紧固件与所述推杆固定。",
      "features": [
        {
          "feature_id": "C4-F1",
          "feature_text": "所述推杆上构造有安装槽，所述驱动杆远离所述第二驱动件的一端设于所述安装槽内，并通过紧固件与所述推杆固定"
        }
      ]
    },
    {
      "claim_no": 5,
      "claim_text": "5.根据权利要求4所述的车载显示设备，其特征在于，所述安装槽包括呈角度设置的第一槽段和第二槽段，所述驱动杆具有呈角度连接的第一杆段和第二杆段，所述第一杆段的一端与所述第二驱动件连接，另一端延伸至所述第一槽段内，所述第二杆段设于所述第二槽段内，且所述第二杆段通过所述紧固件与所述推杆固定。",
      "features": [
        {
          "feature_id": "C5-F1",
          "feature_text": "所述安装槽包括呈角度设置的第一槽段和第二槽段"
        },
        {
          "feature_id": "C5-F2",
          "feature_text": "所述驱动杆具有呈角度连接的第一杆段和第二杆段，所述第一杆段的一端与所述第二驱动件连接，另一端延伸至所述第一槽段内，所述第二杆段设于所述第二槽段内，且所述第二杆段通过所述紧固件与所述推杆固定"
        }
      ]
    },
    {
      "claim_no": 6,
      "claim_text": "6.根据权利要求2-5中任一项所述的车载显示设备，其特征在于，所述车载显示设备还包括位置传感器，所述位置传感器用于获取所述显示器在所述第一方向上的当前位置，所述位置传感器与所述第二驱动件电连接。",
      "features": [
        {
          "feature_id": "C6-F1",
          "feature_text": "所述车载显示设备还包括位置传感器，所述位置传感器用于获取所述显示器在所述第一方向上的当前位置，所述位置传感器与所述第二驱动件电连接"
        }
      ]
    },
    {
      "claim_no": 7,
      "claim_text": "7.根据权利要求2-5中任一项所述的车载显示设备，其特征在于，所述第一驱动机构包括相互连接的第一驱动件及第一驱动部，所述第一驱动部被配置为在所述第一驱动件的作用下作旋转运动，所述第一驱动部与所述显示器连接，其中，所述第一驱动部与所述连接部同轴设置。",
      "features": [
        {
          "feature_id": "C7-F1",
          "feature_text": "所述第一驱动机构包括相互连接的第一驱动件及第一驱动部，所述第一驱动部被配置为在所述第一驱动件的作用下作旋转运动，所述第一驱动部与所述显示器连接，其中，所述第一驱动部与所述连接部同轴设置"
        }
      ]
    },
    {
      "claim_no": 8,
      "claim_text": "8.根据权利要求7所述的车载显示设备，其特征在于，所述第一驱动件包括旋转电机及齿轮箱，所述齿轮箱与所述旋转电机传动连接，所述第一驱动部包括设于所述齿轮箱内的输出轴，所述输出轴与所述显示器连接，且所述输出轴与所述连接部同轴设置。",
      "features": [
        {
          "feature_id": "C8-F1",
          "feature_text": "所述第一驱动件包括旋转电机及齿轮箱，所述齿轮箱与所述旋转电机传动连接"
        },
        {
          "feature_id": "C8-F2",
          "feature_text": "所述第一驱动部包括设于所述齿轮箱内的输出轴，所述输出轴与所述显示器连接，且所述输出轴与所述连接部同轴设置"
        }
      ]
    },
    {
      "claim_no": 9,
      "claim_text": "9.根据权利要求8所述的车载显示设备，其特征在于，所述齿轮箱连接有阻尼转轴，所述阻尼转轴与所述输出轴远离所述显示器的一端连接。",
      "features": [
        {
          "feature_id": "C9-F1",
          "feature_text": "所述齿轮箱连接有阻尼转轴，所述阻尼转轴与所述输出轴远离所述显示器的一端连接"
        }
      ]
    },
    {
      "claim_no": 10,
      "claim_text": "10.根据权利要求8所述的车载显示设备，其特征在于，所述显示器设有第一转动部，所述输出轴用于驱动所述第一转动部旋转，以使所述显示器旋转，其中，所述输出轴与所述第一转动部之间具有连接状态和分离状态，在所述连接状态，所述输出轴与所述第一转动部连接，在所述分离状态，所述输出轴与所述第一转动部分离，其中，所述输出轴上设有打滑机构，所述打滑机构被配置为在所述显示器受到外力作用时使所述连接状态切换至所述分离状态。",
      "features": [
        {
          "feature_id": "C10-F1",
          "feature_text": "所述显示器设有第一转动部"
        },
        {
          "feature_id": "C10-F2",
          "feature_text": "所述输出轴用于驱动所述第一转动部旋转，以使所述显示器旋转"
        },
        {
          "feature_id": "C10-F3",
          "feature_text": "所述输出轴与所述第一转动部之间具有连接状态和分离状态，在所述连接状态，所述输出轴与所述第一转动部连接，在所述分离状态，所述输出轴与所述第一转动部分离"
        },
        {
          "feature_id": "C10-F4",
          "feature_text": "所述输出轴上设有打滑机构，所述打滑机构被配置为在所述显示器受到外力作用时使所述连接状态切换至所述分离状态"
        }
      ]
    },
    {
      "claim_no": 11,
      "claim_text": "11.根据权利要求10所述的车载显示设备，其特征在于，所述显示器还设有第二转动部，所述第一转动部与所述第二转动部分别位于所述显示器的相对两侧，其中，所述第一转动部和/或所述第二转动部设有角度传感器，所述角度传感器被配置为获取所述显示器的当前角度，所述角度传感器与所述旋转电机电连接。",
      "features": [
        {
          "feature_id": "C11-F1",
          "feature_text": "所述显示器还设有第二转动部，所述第一转动部与所述第二转动部分别位于所述显示器的相对两侧"
        },
        {
          "feature_id": "C11-F2",
          "feature_text": "所述第一转动部和/或所述第二转动部设有角度传感器，所述角度传感器被配置为获取所述显示器的当前角度，所述角度传感器与所述旋转电机电连接"
        }
      ]
    },
    {
      "claim_no": 12,
      "claim_text": "12.根据权利要求11所述的车载显示设备，其特征在于，所述车载显示设备还包括第一固定件和第二固定件，所述旋转电机及齿轮箱均设于所述第一固定件，所述第二固定件上构造有固定部，所述第二转动部与所述固定部转动连接，其中，所述第一固定件和所述第二固定件均滑动安装于车辆的顶棚。",
      "features": [
        {
          "feature_id": "C12-F1",
          "feature_text": "所述车载显示设备还包括第一固定件和第二固定件"
        },
        {
          "feature_id": "C12-F2",
          "feature_text": "所述旋转电机及齿轮箱均设于所述第一固定件"
        },
        {
          "feature_id": "C12-F3",
          "feature_text": "所述第二固定件上构造有固定部，所述第二转动部与所述固定部转动连接"
        },
        {
          "feature_id": "C12-F4",
          "feature_text": "所述第一固定件和所述第二固定件均滑动安装于车辆的顶棚"
        }
      ]
    },
    {
      "claim_no": 13,
      "claim_text": "13.根据权利要求1-5中任一项所述的车载显示设备，其特征在于，所述车载显示设备还包括安装于车辆顶棚的锁定机构，所述锁定机构具有可伸缩的锁舌，所述显示器设有锁定孔，所述锁舌被配置为卡接于所述锁定孔内。",
      "features": [
        {
          "feature_id": "C13-F1",
          "feature_text": "所述车载显示设备还包括安装于车辆顶棚的锁定机构，所述锁定机构具有可伸缩的锁舌"
        },
        {
          "feature_id": "C13-F2",
          "feature_text": "所述显示器设有锁定孔，所述锁舌被配置为卡接于所述锁定孔内"
        }
      ]
    },
    {
      "claim_no": 14,
      "claim_text": "14.根据权利要求13所述的车载显示设备，其特征在于，所述显示器连接有锁定件，所述锁定孔构造于所述锁定件。",
      "features": [
        {
          "feature_id": "C14-F1",
          "feature_text": "所述显示器连接有锁定件，所述锁定孔构造于所述锁定件"
        }
      ]
    },
    {
      "claim_no": 15,
      "claim_text": "15.一种车辆，其特征在于，包括如权利要求1-14中任一项所述的车载显示设备。",
      "features": [
        {
          "feature_id": "C15-F1",
          "feature_text": "一种车辆，其特征在于，包括如权利要求1-14中任一项所述的车载显示设备"
        }
      ]
    }
  ],
  "claim_1_text": "1.一种车载显示设备，其特征在于，包括：显示器；第一驱动机构，与所述显示器连接，用于驱动所述显示器转动；第二驱动机构，与所述显示器连接，用于驱动所述显示器及所述第一驱动机构作直线运动。",
  "claim_1_features": [
    {
      "feature_id": "C1-F1",
      "feature_text": "一种车载显示设备"
    },
    {
      "feature_id": "C1-F2",
      "feature_text": "显示器"
    },
    {
      "feature_id": "C1-F3",
      "feature_text": "第一驱动机构，与所述显示器连接，用于驱动所述显示器转动"
    },
    {
      "feature_id": "C1-F4",
      "feature_text": "第二驱动机构，与所述显示器连接，用于驱动所述显示器及所述第一驱动机构作直线运动"
    }
  ],
  "technology_tag": "智能座舱与车联网",
  "claims_source": "html"
}
