{
  "patent": {
    "publication_no": "CN110293961B",
    "country_code": "CN",
    "title": "一种自动泊车系统、方法及车辆",
    "applicants": [
      "BYD Co Ltd"
    ],
    "inventors": [
      "袭悦",
      "吴丽华"
    ],
    "application_date": "2018-03-23",
    "google_patents_url": "https://patents.google.com/patent/CN110293961B/zh",
    "pdf_url": "https://patentimages.storage.googleapis.com/9f/cb/3f/6ff2229e1761a9/CN110293961B.pdf"
  },
  "claims": [
    {
      "claim_no": 1,
      "claim_text": "1.一种自动泊车系统，其特征在于，包括显示单元以及自动泊车控制单元；其中，所述显示单元用于显示车身周围的图像信息，以便于驾驶员根据所述显示单元显示的所述图像信息划定意向泊车区域；所述自动泊车控制单元用于识别驾驶员划定的所述意向泊车区域，对所述意向泊车区域进行优化，优化后的所述意向泊车区域满足泊车所需要的空间大小，并控制车辆根据优化后的所述意向泊车区域实现自动泊车；其中，所述自动泊车控制单元还用于根据所述图像信息选择至少一个优选泊车区域，并将所述至少一个优选泊车区域标定在所述显示单元显示的所述图像信息上。",
      "features": [
        {
          "feature_id": "C1-F1",
          "feature_text": "一种自动泊车系统"
        },
        {
          "feature_id": "C1-F2",
          "feature_text": "包括显示单元以及自动泊车控制单元"
        },
        {
          "feature_id": "C1-F3",
          "feature_text": "所述显示单元用于显示车身周围的图像信息，以便于驾驶员根据所述显示单元显示的所述图像信息划定意向泊车区域"
        },
        {
          "feature_id": "C1-F4",
          "feature_text": "所述自动泊车控制单元用于识别驾驶员划定的所述意向泊车区域，对所述意向泊车区域进行优化，优化后的所述意向泊车区域满足泊车所需要的空间大小，并控制车辆根据优化后的所述意向泊车区域实现自动泊车"
        },
        {
          "feature_id": "C1-F5",
          "feature_text": "所述自动泊车控制单元还用于根据所述图像信息选择至少一个优选泊车区域，并将所述至少一个优选泊车区域标定在所述显示单元显示的所述图像信息上"
        }
      ]
    },
    {
      "claim_no": 2,
      "claim_text": "2.如权利要求1所述的自动泊车系统，其特征在于，所述自动泊车控制单元还用于将识别的所述意向泊车区域向驾驶员反馈，并根据驾驶员确认或者调整后的意向泊车区域控制车辆自动泊车。",
      "features": [
        {
          "feature_id": "C2-F1",
          "feature_text": "所述自动泊车控制单元还用于将识别的所述意向泊车区域向驾驶员反馈，并根据驾驶员确认或者调整后的意向泊车区域控制车辆自动泊车"
        }
      ]
    },
    {
      "claim_no": 3,
      "claim_text": "3.如权利要求1所述的自动泊车系统，其特征在于，所述自动泊车控制单元还用于对所述意向泊车区域进行障碍物识别，并在识别出影响泊车的障碍物时提醒驾驶员重新划定意向泊车区域。",
      "features": [
        {
          "feature_id": "C3-F1",
          "feature_text": "所述自动泊车控制单元还用于对所述意向泊车区域进行障碍物识别，并在识别出影响泊车的障碍物时提醒驾驶员重新划定意向泊车区域"
        }
      ]
    },
    {
      "claim_no": 4,
      "claim_text": "4.如权利要求1所述的自动泊车系统，其特征在于，所述自动泊车系统还包括探测模块，用于对所述意向泊车区域进行障碍物检测，所述探测模块包括雷达和/或超声波检测单元。",
      "features": [
        {
          "feature_id": "C4-F1",
          "feature_text": "所述自动泊车系统还包括探测模块，用于对所述意向泊车区域进行障碍物检测，所述探测模块包括雷达和/或超声波检测单元"
        }
      ]
    },
    {
      "claim_no": 5,
      "claim_text": "5.如权利要求1所述的自动泊车系统，其特征在于，所述自动泊车系统还包括输入模块，以便于驾驶员划定所述意向泊车区域，所述输入模块包括触控板、触控屏、鼠标、手势识别模块和语音识别模块中的至少一个。",
      "features": [
        {
          "feature_id": "C5-F1",
          "feature_text": "所述自动泊车系统还包括输入模块，以便于驾驶员划定所述意向泊车区域，所述输入模块包括触控板、触控屏、鼠标、手势识别模块和语音识别模块中的至少一个"
        }
      ]
    },
    {
      "claim_no": 6,
      "claim_text": "6.如权利要求1所述的自动泊车系统，其特征在于，所述自动泊车系统还包括至少一个摄像头，所述至少一个摄像头用于采集车身周围的图像信息。",
      "features": [
        {
          "feature_id": "C6-F1",
          "feature_text": "所述自动泊车系统还包括至少一个摄像头，所述至少一个摄像头用于采集车身周围的图像信息"
        }
      ]
    },
    {
      "claim_no": 7,
      "claim_text": "7.如权利要求6所述的自动泊车系统，其特征在于，所述自动泊车系统还包括视频采集卡，所述视频采集卡用于对所述车身周围的图像信息进行处理，并将处理后的图像信息发送到所述显示单元进行显示。",
      "features": [
        {
          "feature_id": "C7-F1",
          "feature_text": "所述自动泊车系统还包括视频采集卡，所述视频采集卡用于对所述车身周围的图像信息进行处理，并将处理后的图像信息发送到所述显示单元进行显示"
        }
      ]
    },
    {
      "claim_no": 8,
      "claim_text": "8.如权利要求6所述的自动泊车系统，其特征在于，所述自动泊车系统还包括视频采集卡，所述视频采集卡用于将所述车身周围的图像信息合并处理为全景图像信息，并将所述全景图像信息发送到所述显示单元进行显示。",
      "features": [
        {
          "feature_id": "C8-F1",
          "feature_text": "所述自动泊车系统还包括视频采集卡，所述视频采集卡用于将所述车身周围的图像信息合并处理为全景图像信息，并将所述全景图像信息发送到所述显示单元进行显示"
        }
      ]
    },
    {
      "claim_no": 9,
      "claim_text": "9.一种车辆，其特征在于，包括权利要求1到8任一项所述的自动泊车系统。",
      "features": [
        {
          "feature_id": "C9-F1",
          "feature_text": "一种车辆，包括权利要求1到8任一项所述的自动泊车系统"
        }
      ]
    },
    {
      "claim_no": 10,
      "claim_text": "10.一种自动泊车方法，其特征在于，所述自动泊车方法包括以下步骤：显示车身周围的图像信息，以便于驾驶员根据显示的所述图像信息划定意向泊车区域；识别驾驶员划定的所述意向泊车区域，对所述意向泊车区域进行优化，优化后的所述意向泊车区域满足泊车所需要的空间大小，并控制车辆根据所述意向泊车区域实现自动泊车；其中，所述方法还包括根据所述图像信息选择至少一个优选泊车区域，并将所述至少一个优选泊车区域标定在显示的所述图像信息上。",
      "features": [
        {
          "feature_id": "C10-F1",
          "feature_text": "一种自动泊车方法"
        },
        {
          "feature_id": "C10-F2",
          "feature_text": "显示车身周围的图像信息，以便于驾驶员根据显示的所述图像信息划定意向泊车区域"
        },
        {
          "feature_id": "C10-F3",
          "feature_text": "识别驾驶员划定的所述意向泊车区域，对所述意向泊车区域进行优化，优化后的所述意向泊车区域满足泊车所需要的空间大小，并控制车辆根据所述意向泊车区域实现自动泊车"
        },
        {
          "feature_id": "C10-F4",
          "feature_text": "所述方法还包括根据所述图像信息选择至少一个优选泊车区域，并将所述至少一个优选泊车区域标定在显示的所述图像信息上"
        }
      ]
    },
    {
      "claim_no": 11,
      "claim_text": "11.如权利要求10所述的自动泊车方法，其特征在于，所述自动泊车方法还包括将识别的所述意向泊车区域向驾驶员反馈，并根据驾驶员确认或者调整后的意向泊车区域控制车辆自动泊车。",
      "features": [
        {
          "feature_id": "C11-F1",
          "feature_text": "所述自动泊车方法还包括将识别的所述意向泊车区域向驾驶员反馈，并根据驾驶员确认或者调整后的意向泊车区域控制车辆自动泊车"
        }
      ]
    },
    {
      "claim_no": 12,
      "claim_text": "12.如权利要求10所述的自动泊车方法，其特征在于，所述自动泊车方法还包括对所述意向泊车区域进行障碍物识别，并在识别出影响泊车的障碍物时提醒驾驶员重新划定意向泊车区域。",
      "features": [
        {
          "feature_id": "C12-F1",
          "feature_text": "所述自动泊车方法还包括对所述意向泊车区域进行障碍物识别，并在识别出影响泊车的障碍物时提醒驾驶员重新划定意向泊车区域"
        }
      ]
    },
    {
      "claim_no": 13,
      "claim_text": "13.如权利要求10所述的自动泊车方法，其特征在于，所述自动泊车方法还包括采集车身周围的图像信息。",
      "features": [
        {
          "feature_id": "C13-F1",
          "feature_text": "所述自动泊车方法还包括采集车身周围的图像信息"
        }
      ]
    },
    {
      "claim_no": 14,
      "claim_text": "14.如权利要求13所述的自动泊车方法，其特征在于，所述自动泊车方法还包括对所述车身周围的图像信息进行处理，并将处理后的图像信息发送并显示。",
      "features": [
        {
          "feature_id": "C14-F1",
          "feature_text": "所述自动泊车方法还包括对所述车身周围的图像信息进行处理，并将处理后的图像信息发送并显示"
        }
      ]
    },
    {
      "claim_no": 15,
      "claim_text": "15.如权利要求13所述的自动泊车方法，其特征在于，所述自动泊车方法还包括将所述车身周围的图像信息合并处理为全景图像信息，并将所述全景图像信息发送并显示。",
      "features": [
        {
          "feature_id": "C15-F1",
          "feature_text": "所述自动泊车方法还包括将所述车身周围的图像信息合并处理为全景图像信息，并将所述全景图像信息发送并显示"
        }
      ]
    }
  ],
  "claim_1_text": "1.一种自动泊车系统，其特征在于，包括显示单元以及自动泊车控制单元；其中，所述显示单元用于显示车身周围的图像信息，以便于驾驶员根据所述显示单元显示的所述图像信息划定意向泊车区域；所述自动泊车控制单元用于识别驾驶员划定的所述意向泊车区域，对所述意向泊车区域进行优化，优化后的所述意向泊车区域满足泊车所需要的空间大小，并控制车辆根据优化后的所述意向泊车区域实现自动泊车；其中，所述自动泊车控制单元还用于根据所述图像信息选择至少一个优选泊车区域，并将所述至少一个优选泊车区域标定在所述显示单元显示的所述图像信息上。",
  "claim_1_features": [
    {
      "feature_id": "C1-F1",
      "feature_text": "一种自动泊车系统"
    },
    {
      "feature_id": "C1-F2",
      "feature_text": "包括显示单元以及自动泊车控制单元"
    },
    {
      "feature_id": "C1-F3",
      "feature_text": "所述显示单元用于显示车身周围的图像信息，以便于驾驶员根据所述显示单元显示的所述图像信息划定意向泊车区域"
    },
    {
      "feature_id": "C1-F4",
      "feature_text": "所述自动泊车控制单元用于识别驾驶员划定的所述意向泊车区域，对所述意向泊车区域进行优化，优化后的所述意向泊车区域满足泊车所需要的空间大小，并控制车辆根据优化后的所述意向泊车区域实现自动泊车"
    },
    {
      "feature_id": "C1-F5",
      "feature_text": "所述自动泊车控制单元还用于根据所述图像信息选择至少一个优选泊车区域，并将所述至少一个优选泊车区域标定在所述显示单元显示的所述图像信息上"
    }
  ],
  "technology_tag": "自动驾驶与传感",
  "claims_source": "html"
}
