{
  "patent": {
    "publication_no": "CN216974483U",
    "country_code": "CN",
    "title": "车门外把手和具有其的车辆",
    "applicants": [
      "比亚迪股份有限公司"
    ],
    "inventors": [
      "黄昭华",
      "张建强",
      "蔡泽鹏",
      "吴秀霞",
      "李岩"
    ],
    "application_date": "2021-04-16",
    "google_patents_url": "https://patents.google.com/patent/CN216974483U/zh",
    "pdf_url": "https://patentimages.storage.googleapis.com/82/80/40/9a83f614ea81d1/CN216974483U.pdf"
  },
  "claims": [
    {
      "claim_no": 1,
      "claim_text": "1.一种车门外把手，其特征在于，包括：把手座，所述把手座适于安装于车门；微动开关，所述微动开关设于所述把手座内，所述微动开关具有从所述把手座露出的触点；上掀手柄，所述上掀手柄在掀起位置和关闭位置之间可翻转地安装于所述把手座，所述上掀手柄位于所述掀起位置时向车门外侧展开，所述上掀手柄位于所述关闭位置时遮盖所述把手座；微动按键，所述微动按键安装于所述上掀手柄的外表面，所述上掀手柄位于所述关闭位置时遮盖所述微动开关，且所述微动按键与所述微动开关的触点接触，所述微动按键通过触动所述触点以使所述微动开关发送解锁信号和/或锁止信号。",
      "features": [
        {
          "feature_id": "C1-F1",
          "feature_text": "一种车门外把手"
        },
        {
          "feature_id": "C1-F2",
          "feature_text": "把手座，所述把手座适于安装于车门"
        },
        {
          "feature_id": "C1-F3",
          "feature_text": "微动开关，所述微动开关设于所述把手座内，所述微动开关具有从所述把手座露出的触点"
        },
        {
          "feature_id": "C1-F4",
          "feature_text": "上掀手柄，所述上掀手柄在掀起位置和关闭位置之间可翻转地安装于所述把手座，所述上掀手柄位于所述掀起位置时向车门外侧展开，所述上掀手柄位于所述关闭位置时遮盖所述把手座"
        },
        {
          "feature_id": "C1-F5",
          "feature_text": "微动按键，所述微动按键安装于所述上掀手柄的外表面，所述上掀手柄位于所述关闭位置时遮盖所述微动开关，且所述微动按键与所述微动开关的触点接触，所述微动按键通过触动所述触点以使所述微动开关发送解锁信号和/或锁止信号"
        }
      ]
    },
    {
      "claim_no": 2,
      "claim_text": "2.根据权利要求1所述的车门外把手，其特征在于，所述上掀手柄位于所述关闭位置时所述上掀手柄的外表面适于与车门的外表面平齐。",
      "features": [
        {
          "feature_id": "C2-F1",
          "feature_text": "所述上掀手柄位于所述关闭位置时所述上掀手柄的外表面适于与车门的外表面平齐"
        }
      ]
    },
    {
      "claim_no": 3,
      "claim_text": "3.根据权利要求1所述的车门外把手，其特征在于，还包括：锁芯，所述锁芯安装于所述把手座内，所述锁芯具有从所述把手座露出的钥匙孔，所述上掀手柄位于所述关闭位置时遮盖所述钥匙孔，所述上掀手柄位于所述掀起位置时露出所述钥匙孔。",
      "features": [
        {
          "feature_id": "C3-F1",
          "feature_text": "锁芯，所述锁芯安装于所述把手座内，所述锁芯具有从所述把手座露出的钥匙孔，所述上掀手柄位于所述关闭位置时遮盖所述钥匙孔，所述上掀手柄位于所述掀起位置时露出所述钥匙孔"
        }
      ]
    },
    {
      "claim_no": 4,
      "claim_text": "4.根据权利要求1所述的车门外把手，其特征在于，所述把手座设有多个预定位卡脚，所述把手座通过多个所述预定位卡脚与车门在车门的内外方向上预定位，所述把手座设有与车门进一步紧固的多个螺纹紧固件。",
      "features": [
        {
          "feature_id": "C4-F1",
          "feature_text": "所述把手座设有多个预定位卡脚，所述把手座通过多个所述预定位卡脚与车门在车门的内外方向上预定位，所述把手座设有与车门进一步紧固的多个螺纹紧固件"
        }
      ]
    },
    {
      "claim_no": 5,
      "claim_text": "5.根据权利要求4所述的车门外把手，其特征在于，所述预定位卡脚构造有导向斜面，所述导向斜面通过与车门配合而引导所述预定位卡脚卡合于车门。",
      "features": [
        {
          "feature_id": "C5-F1",
          "feature_text": "所述预定位卡脚构造有导向斜面，所述导向斜面通过与车门配合而引导所述预定位卡脚卡合于车门"
        }
      ]
    },
    {
      "claim_no": 6,
      "claim_text": "6.根据权利要求1所述的车门外把手，其特征在于，所述把手座的背向所述上掀手柄的一侧设有用于密封所述把手座和车门之间缝隙的密封圈，所述密封圈位于所述把手座的外周缘且沿所述把手座的外周缘的周向延伸。",
      "features": [
        {
          "feature_id": "C6-F1",
          "feature_text": "所述把手座的背向所述上掀手柄的一侧设有用于密封所述把手座和车门之间缝隙的密封圈，所述密封圈位于所述把手座的外周缘且沿所述把手座的外周缘的周向延伸"
        }
      ]
    },
    {
      "claim_no": 7,
      "claim_text": "7.根据权利要求1所述的车门外把手，其特征在于，所述把手座的朝向所述上掀手柄的一侧安装有气密垫，所述上掀手柄的朝向所述把手座的一侧设有扣手槽，所述上掀手柄位于所述关闭位置时所述扣手槽的边沿止抵于所述气密垫。",
      "features": [
        {
          "feature_id": "C7-F1",
          "feature_text": "所述把手座的朝向所述上掀手柄的一侧安装有气密垫，所述上掀手柄的朝向所述把手座的一侧设有扣手槽，所述上掀手柄位于所述关闭位置时所述扣手槽的边沿止抵于所述气密垫"
        }
      ]
    },
    {
      "claim_no": 8,
      "claim_text": "8.根据权利要求1所述的车门外把手，其特征在于，所述微动开关连接有传输所述解锁信号和/或所述锁止信号的转接线，所述转接线具有转接头，所述转接头设有滑轨，所述把手座的背向所述上掀手柄的一侧设有滑槽，所述滑轨通过滑动卡接于所述滑槽。",
      "features": [
        {
          "feature_id": "C8-F1",
          "feature_text": "所述微动开关连接有传输所述解锁信号和/或所述锁止信号的转接线，所述转接线具有转接头，所述转接头设有滑轨，所述把手座的背向所述上掀手柄的一侧设有滑槽，所述滑轨通过滑动卡接于所述滑槽"
        }
      ]
    },
    {
      "claim_no": 9,
      "claim_text": "9.根据权利要求1所述的车门外把手，其特征在于，所述把手座上设有贯通孔，所述把手座的背向所述上掀手柄的一侧设有沿所述把手座的长度方向间隔设置的第一连接臂和第二连接臂，所述第一连接臂与所述第二连接臂之间设置有转轴；所述上掀手柄的朝向所述把手座的一侧设有摇臂，所述摇臂穿过所述贯通孔并转动套设在所述转轴上。",
      "features": [
        {
          "feature_id": "C9-F1",
          "feature_text": "所述把手座上设有贯通孔，所述把手座的背向所述上掀手柄的一侧设有沿所述把手座的长度方向间隔设置的第一连接臂和第二连接臂，所述第一连接臂与所述第二连接臂之间设置有转轴"
        },
        {
          "feature_id": "C9-F2",
          "feature_text": "所述上掀手柄的朝向所述把手座的一侧设有摇臂，所述摇臂穿过所述贯通孔并转动套设在所述转轴上"
        }
      ]
    },
    {
      "claim_no": 10,
      "claim_text": "10.根据权利要求9所述的车门外把手，其特征在于，还包括：所述摇臂包括沿上掀手柄的长度方向的第一摇臂及第二摇臂，所述贯通孔包括沿所述把手座的长度方向间隔设置的第一贯通孔及第二贯通孔，所述第一摇臂与所述第一贯通孔对应设置，所述第二摇臂与所述第二贯通孔对应设置；复位扭簧，所述把手座的背向所述上掀手柄的一侧设有凸筋，所述第一摇臂设有第一摇臂槽，所述第二摇臂设有第二摇臂槽，所述复位扭簧套设于所述转轴，所述复位扭簧的长度方向的中部钩挂于所述凸筋，所述复位扭簧的两端分别钩挂于所述第一摇臂槽和所述第二摇臂槽。",
      "features": [
        {
          "feature_id": "C10-F1",
          "feature_text": "所述摇臂包括沿上掀手柄的长度方向的第一摇臂及第二摇臂，所述贯通孔包括沿所述把手座的长度方向间隔设置的第一贯通孔及第二贯通孔，所述第一摇臂与所述第一贯通孔对应设置，所述第二摇臂与所述第二贯通孔对应设置"
        },
        {
          "feature_id": "C10-F2",
          "feature_text": "复位扭簧，所述把手座的背向所述上掀手柄的一侧设有凸筋，所述第一摇臂设有第一摇臂槽，所述第二摇臂设有第二摇臂槽，所述复位扭簧套设于所述转轴，所述复位扭簧的长度方向的中部钩挂于所述凸筋，所述复位扭簧的两端分别钩挂于所述第一摇臂槽和所述第二摇臂槽"
        }
      ]
    },
    {
      "claim_no": 11,
      "claim_text": "11.一种车辆，其特征在于，包括：车门，所述车门的外表面构造有有凹部；根据权利要求1-10中任一项所述的车门外把手，所述把手座安装于所述车门的凹部，所述凹部在所述上掀手柄的下方形成伸入空间。",
      "features": [
        {
          "feature_id": "C11-F1",
          "feature_text": "一种车辆"
        },
        {
          "feature_id": "C11-F2",
          "feature_text": "车门，所述车门的外表面构造有有凹部"
        },
        {
          "feature_id": "C11-F3",
          "feature_text": "车门外把手，所述把手座安装于所述车门的凹部，所述凹部在所述上掀手柄的下方形成伸入空间"
        }
      ]
    }
  ],
  "claim_1_text": "1.一种车门外把手，其特征在于，包括：把手座，所述把手座适于安装于车门；微动开关，所述微动开关设于所述把手座内，所述微动开关具有从所述把手座露出的触点；上掀手柄，所述上掀手柄在掀起位置和关闭位置之间可翻转地安装于所述把手座，所述上掀手柄位于所述掀起位置时向车门外侧展开，所述上掀手柄位于所述关闭位置时遮盖所述把手座；微动按键，所述微动按键安装于所述上掀手柄的外表面，所述上掀手柄位于所述关闭位置时遮盖所述微动开关，且所述微动按键与所述微动开关的触点接触，所述微动按键通过触动所述触点以使所述微动开关发送解锁信号和/或锁止信号。",
  "claim_1_features": [
    {
      "feature_id": "C1-F1",
      "feature_text": "一种车门外把手"
    },
    {
      "feature_id": "C1-F2",
      "feature_text": "把手座，所述把手座适于安装于车门"
    },
    {
      "feature_id": "C1-F3",
      "feature_text": "微动开关，所述微动开关设于所述把手座内，所述微动开关具有从所述把手座露出的触点"
    },
    {
      "feature_id": "C1-F4",
      "feature_text": "上掀手柄，所述上掀手柄在掀起位置和关闭位置之间可翻转地安装于所述把手座，所述上掀手柄位于所述掀起位置时向车门外侧展开，所述上掀手柄位于所述关闭位置时遮盖所述把手座"
    },
    {
      "feature_id": "C1-F5",
      "feature_text": "微动按键，所述微动按键安装于所述上掀手柄的外表面，所述上掀手柄位于所述关闭位置时遮盖所述微动开关，且所述微动按键与所述微动开关的触点接触，所述微动按键通过触动所述触点以使所述微动开关发送解锁信号和/或锁止信号"
    }
  ],
  "technology_tag": "车身与底盘",
  "claims_source": "html"
}
