{
  "patent": {
    "publication_no": "CN101725317B",
    "country_code": "CN",
    "title": "一种调光玻璃及其制作方法",
    "applicants": [
      "BYD Co Ltd"
    ],
    "inventors": [
      "薛亮"
    ],
    "application_date": "2008-10-31",
    "google_patents_url": "https://patents.google.com/patent/CN101725317B/zh",
    "pdf_url": "https://patentimages.storage.googleapis.com/ca/67/7d/5e7749d9c39b27/CN101725317B.pdf"
  },
  "claims": [
    {
      "claim_no": 1,
      "claim_text": "1.一种调光玻璃，其特征在于，该调光玻璃包括依次层叠的第一基体、聚合物分散液晶层、导电层、粘合层和第二基体，其中，第一基体、聚合物分散液晶层和导电层为一体结构；第一基体为导电玻璃，第二基体为硬质膜层；或者第一基体为导电硬质膜层，第二基体为玻璃。",
      "features": [
        {
          "feature_id": "C1-F1",
          "feature_text": "一种调光玻璃"
        },
        {
          "feature_id": "C1-F2",
          "feature_text": "该调光玻璃包括依次层叠的第一基体、聚合物分散液晶层、导电层、粘合层和第二基体"
        },
        {
          "feature_id": "C1-F3",
          "feature_text": "第一基体、聚合物分散液晶层和导电层为一体结构"
        },
        {
          "feature_id": "C1-F4",
          "feature_text": "第一基体为导电玻璃，第二基体为硬质膜层"
        },
        {
          "feature_id": "C1-F5",
          "feature_text": "或者第一基体为导电硬质膜层，第二基体为玻璃"
        }
      ]
    },
    {
      "claim_no": 2,
      "claim_text": "2.根据权利要求1所述的调光玻璃，其中，所述导电硬质膜层包括基底、附着于基底表面的硬涂层和附着在硬涂层表面的导电膜，该导电膜与所述聚合物分散液晶层接触；所述硬质膜层包括基底和附着于基底表面的硬涂层；所述基底的材料为聚酯树脂、乙酸酯树脂、聚醚砜树脂、聚碳酸酯树脂、聚烯烃树脂、聚氯乙烯树脂、聚苯乙烯树脂、聚乙烯醇树脂、聚烯丙基化树脂、聚苯硫醚树脂和(甲基)丙烯酸树脂中的一种或几种；所述硬涂层为氧化硅层或氧化钛层，或者所述硬涂层的材料为氨基甲酸酯树脂、三聚氰胺树脂、醇酸树脂、环氧树脂、砜类树脂、酰胺类树脂、酰亚胺类树脂、聚醚砜树脂、聚醚酰亚胺树脂、乙烯基吡咯烷酮树脂、纤维素类树脂、丙烯腈树脂中的一种或几种；所述导电膜为氧化铟锡膜、锌铝氧化物膜或铟锌氧化物膜。",
      "features": [
        {
          "feature_id": "C2-F1",
          "feature_text": "所述导电硬质膜层包括基底、附着于基底表面的硬涂层和附着在硬涂层表面的导电膜，该导电膜与所述聚合物分散液晶层接触"
        },
        {
          "feature_id": "C2-F2",
          "feature_text": "所述硬质膜层包括基底和附着于基底表面的硬涂层"
        },
        {
          "feature_id": "C2-F3",
          "feature_text": "所述基底的材料为聚酯树脂、乙酸酯树脂、聚醚砜树脂、聚碳酸酯树脂、聚烯烃树脂、聚氯乙烯树脂、聚苯乙烯树脂、聚乙烯醇树脂、聚烯丙基化树脂、聚苯硫醚树脂和(甲基)丙烯酸树脂中的一种或几种"
        },
        {
          "feature_id": "C2-F4",
          "feature_text": "所述硬涂层为氧化硅层或氧化钛层，或者所述硬涂层的材料为氨基甲酸酯树脂、三聚氰胺树脂、醇酸树脂、环氧树脂、砜类树脂、酰胺类树脂、酰亚胺类树脂、聚醚砜树脂、聚醚酰亚胺树脂、乙烯基吡咯烷酮树脂、纤维素类树脂、丙烯腈树脂中的一种或几种"
        },
        {
          "feature_id": "C2-F5",
          "feature_text": "所述导电膜为氧化铟锡膜、锌铝氧化物膜或铟锌氧化物膜"
        }
      ]
    },
    {
      "claim_no": 3,
      "claim_text": "3.根据权利要求1所述的调光玻璃，其中，所述导电玻璃包括玻璃和附着在玻璃表面的导电膜，该导电膜与所述聚合物分散液晶层接触；所述导电膜为氧化铟锡膜、锌铝氧化物膜或铟锌氧化物膜。",
      "features": [
        {
          "feature_id": "C3-F1",
          "feature_text": "所述导电玻璃包括玻璃和附着在玻璃表面的导电膜，该导电膜与所述聚合物分散液晶层接触"
        },
        {
          "feature_id": "C3-F2",
          "feature_text": "所述导电膜为氧化铟锡膜、锌铝氧化物膜或铟锌氧化物膜"
        }
      ]
    },
    {
      "claim_no": 4,
      "claim_text": "4.根据权利要求1所述的调光玻璃，其中，所述导电层包括基底和附着于基底表面的导电膜，所述基底的材料为聚酯树脂、乙酸酯树脂、聚醚砜树脂、聚碳酸酯树脂、聚酰胺树脂、聚酰亚胺树脂、聚烯烃树脂、聚氯乙烯树脂、聚苯乙烯树脂、聚乙烯醇树脂、聚烯丙基化树脂、聚苯硫醚树脂和(甲基）丙烯酸树脂中的一种或几种；所述导电膜为氧化铟锡膜、锌铝氧化物膜或铟锌氧化物膜。",
      "features": [
        {
          "feature_id": "C4-F1",
          "feature_text": "所述导电层包括基底和附着于基底表面的导电膜，所述基底的材料为聚酯树脂、乙酸酯树脂、聚醚砜树脂、聚碳酸酯树脂、聚酰胺树脂、聚酰亚胺树脂、聚烯烃树脂、聚氯乙烯树脂、聚苯乙烯树脂、聚乙烯醇树脂、聚烯丙基化树脂、聚苯硫醚树脂和(甲基）丙烯酸树脂中的一种或几种"
        },
        {
          "feature_id": "C4-F2",
          "feature_text": "所述导电膜为氧化铟锡膜、锌铝氧化物膜或铟锌氧化物膜"
        }
      ]
    },
    {
      "claim_no": 5,
      "claim_text": "5.根据权利要求1所述的调光玻璃，其中，所述粘合层的厚度为0.1-0.4mm；所述粘合层的材料为乙烯-醋酸乙烯共聚物、聚氯乙烯和聚乙烯醇缩丁醛中的一种或几种。",
      "features": [
        {
          "feature_id": "C5-F1",
          "feature_text": "所述粘合层的厚度为0.1-0.4mm"
        },
        {
          "feature_id": "C5-F2",
          "feature_text": "所述粘合层的材料为乙烯-醋酸乙烯共聚物、聚氯乙烯和聚乙烯醇缩丁醛中的一种或几种"
        }
      ]
    },
    {
      "claim_no": 6,
      "claim_text": "6.权利要求1所述的调光玻璃的制作方法，其特征在于，该方法包括将在第一基体和导电层之间形成聚合物分散液晶层，得到第一基体、聚合物分散液晶层和导电层的一体结构，并将该一体结构、粘合层和第二基体依次叠放并层合，其中，第一基体为导电玻璃，第二基体为硬质膜层；或者第一基体为导电硬质膜层，第二基体为玻璃。",
      "features": [
        {
          "feature_id": "C6-F1",
          "feature_text": "调光玻璃的制作方法"
        },
        {
          "feature_id": "C6-F2",
          "feature_text": "该方法包括将在第一基体和导电层之间形成聚合物分散液晶层，得到第一基体、聚合物分散液晶层和导电层的一体结构"
        },
        {
          "feature_id": "C6-F3",
          "feature_text": "并将该一体结构、粘合层和第二基体依次叠放并层合"
        },
        {
          "feature_id": "C6-F4",
          "feature_text": "第一基体为导电玻璃，第二基体为硬质膜层"
        },
        {
          "feature_id": "C6-F5",
          "feature_text": "或者第一基体为导电硬质膜层，第二基体为玻璃"
        }
      ]
    },
    {
      "claim_no": 7,
      "claim_text": "7.根据权利要求6所述的方法，其中，在第一基体和导电层之间形成聚合物分散液晶层的过程包括在第一基体的表面涂覆含有聚合物单体和液晶的混合物，将导电层覆在该混合物上，固化。",
      "features": [
        {
          "feature_id": "C7-F1",
          "feature_text": "在第一基体和导电层之间形成聚合物分散液晶层的过程包括在第一基体的表面涂覆含有聚合物单体和液晶的混合物，将导电层覆在该混合物上，固化"
        }
      ]
    },
    {
      "claim_no": 8,
      "claim_text": "8.根据权利要求7所述的方法，其中，所述聚合物单体和液晶的重量比为1：1-20，所述聚合物单体为（甲基）丙烯酸和/或（甲基）丙烯酸酯，所述液晶为三联苯类液晶、乙炔桥键类液晶、双环己烷类液晶和苯基环己烷类液晶中的一种或几种。",
      "features": [
        {
          "feature_id": "C8-F1",
          "feature_text": "所述聚合物单体和液晶的重量比为1：1-20"
        },
        {
          "feature_id": "C8-F2",
          "feature_text": "所述聚合物单体为（甲基）丙烯酸和/或（甲基）丙烯酸酯"
        },
        {
          "feature_id": "C8-F3",
          "feature_text": "所述液晶为三联苯类液晶、乙炔桥键类液晶、双环己烷类液晶和苯基环己烷类液晶中的一种或几种"
        }
      ]
    },
    {
      "claim_no": 9,
      "claim_text": "9.根据权利要求6所述的方法，其中，所述层合的温度为80-200℃，层合的时间为10-60分钟，并且所述层合在真空条件下进行，该真空条件的绝对压力为0.06-0.09MPa。",
      "features": [
        {
          "feature_id": "C9-F1",
          "feature_text": "所述层合的温度为80-200℃"
        },
        {
          "feature_id": "C9-F2",
          "feature_text": "层合的时间为10-60分钟"
        },
        {
          "feature_id": "C9-F3",
          "feature_text": "并且所述层合在真空条件下进行，该真空条件的绝对压力为0.06-0.09MPa"
        }
      ]
    }
  ],
  "claim_1_text": "1.一种调光玻璃，其特征在于，该调光玻璃包括依次层叠的第一基体、聚合物分散液晶层、导电层、粘合层和第二基体，其中，第一基体、聚合物分散液晶层和导电层为一体结构；第一基体为导电玻璃，第二基体为硬质膜层；或者第一基体为导电硬质膜层，第二基体为玻璃。",
  "claim_1_features": [
    {
      "feature_id": "C1-F1",
      "feature_text": "一种调光玻璃"
    },
    {
      "feature_id": "C1-F2",
      "feature_text": "该调光玻璃包括依次层叠的第一基体、聚合物分散液晶层、导电层、粘合层和第二基体"
    },
    {
      "feature_id": "C1-F3",
      "feature_text": "第一基体、聚合物分散液晶层和导电层为一体结构"
    },
    {
      "feature_id": "C1-F4",
      "feature_text": "第一基体为导电玻璃，第二基体为硬质膜层"
    },
    {
      "feature_id": "C1-F5",
      "feature_text": "或者第一基体为导电硬质膜层，第二基体为玻璃"
    }
  ],
  "technology_tag": "其他",
  "claims_source": "html"
}
