{
  "patent": {
    "publication_no": "CN206374813U",
    "country_code": "CN",
    "title": "前副车架及汽车",
    "applicants": [
      "BYD Co Ltd"
    ],
    "inventors": [
      "胡斐",
      "林波",
      "刘彦杰",
      "蔡昭华"
    ],
    "application_date": "2016-12-26",
    "google_patents_url": "https://patents.google.com/patent/CN206374813U/zh",
    "pdf_url": "https://patentimages.storage.googleapis.com/1c/0c/1b/2134b936138c26/CN206374813U.pdf"
  },
  "claims": [
    {
      "claim_no": 1,
      "claim_text": "1.一种前副车架，其特征在于，包括左纵梁总成、右纵梁总成、前横梁及后横梁，所述左纵梁总成包括左纵梁及与所述左纵梁一体成型的多个左侧安装支架，所述右纵梁总成包括右纵梁及与所述右纵梁一体成型的多个右侧安装支架，所述前横梁的左端与所述左纵梁的前端连接，所述前横梁的右端与所述右纵梁的前端连接，所述后横梁的左端与所述左纵梁的后端连接，所述后横梁的右端与所述右纵梁的后端连接。",
      "features": [
        {
          "feature_id": "C1-F1",
          "feature_text": "一种前副车架"
        },
        {
          "feature_id": "C1-F2",
          "feature_text": "包括左纵梁总成、右纵梁总成、前横梁及后横梁"
        },
        {
          "feature_id": "C1-F3",
          "feature_text": "所述左纵梁总成包括左纵梁及与所述左纵梁一体成型的多个左侧安装支架"
        },
        {
          "feature_id": "C1-F4",
          "feature_text": "所述右纵梁总成包括右纵梁及与所述右纵梁一体成型的多个右侧安装支架"
        },
        {
          "feature_id": "C1-F5",
          "feature_text": "所述前横梁的左端与所述左纵梁的前端连接，所述前横梁的右端与所述右纵梁的前端连接"
        },
        {
          "feature_id": "C1-F6",
          "feature_text": "所述后横梁的左端与所述左纵梁的后端连接，所述后横梁的右端与所述右纵梁的后端连接"
        }
      ]
    },
    {
      "claim_no": 2,
      "claim_text": "2.根据权利要求1所述的前副车架，其特征在于，所述左纵梁总成为通过差压铸造的方式一体成型的铝合金结构件，所述左纵梁的内部中空；所述右纵梁总成为通过差压铸造的方式一体成型的铝合金结构件，所述右纵梁的内部中空。",
      "features": [
        {
          "feature_id": "C2-F1",
          "feature_text": "所述左纵梁总成为通过差压铸造的方式一体成型的铝合金结构件，所述左纵梁的内部中空"
        },
        {
          "feature_id": "C2-F2",
          "feature_text": "所述右纵梁总成为通过差压铸造的方式一体成型的铝合金结构件，所述右纵梁的内部中空"
        }
      ]
    },
    {
      "claim_no": 3,
      "claim_text": "3.根据权利要求1所述的前副车架，其特征在于，所述前横梁及后横梁均为一体挤压成型的中空铝合金型材。",
      "features": [
        {
          "feature_id": "C3-F1",
          "feature_text": "所述前横梁及后横梁均为一体挤压成型的中空铝合金型材"
        }
      ]
    },
    {
      "claim_no": 4,
      "claim_text": "4.根据权利要求1所述的前副车架，其特征在于，所述多个左侧安装支架包括左前车身连接支架、摆臂左前安装支架、摆臂左后安装支架、左后车身连接支架、稳定杆左安装支架及转向器左安装支架；所述多个右侧安装支架包括右前车身连接支架、摆臂右前安装支架、摆臂右后安装支架、右后车身连接支架、稳定杆右安装支架及转向器右安装支架。",
      "features": [
        {
          "feature_id": "C4-F1",
          "feature_text": "所述多个左侧安装支架包括左前车身连接支架、摆臂左前安装支架、摆臂左后安装支架、左后车身连接支架、稳定杆左安装支架及转向器左安装支架"
        },
        {
          "feature_id": "C4-F2",
          "feature_text": "所述多个右侧安装支架包括右前车身连接支架、摆臂右前安装支架、摆臂右后安装支架、右后车身连接支架、稳定杆右安装支架及转向器右安装支架"
        }
      ]
    },
    {
      "claim_no": 5,
      "claim_text": "5.根据权利要求4所述的前副车架，其特征在于，所述左前车身连接支架、摆臂左前安装支架、摆臂左后安装支架、左后车身连接支架、稳定杆左安装支架及转向器左安装支架位于所述左纵梁的上表面；所述左前车身连接支架、摆臂左前安装支架、转向器左安装支架、摆臂左后安装支架及左后车身连接支架由前至后依次排布，所述稳定杆左安装支架在前副车架的左右方向上位于所述摆臂左后安装支架的内侧；所述右前车身连接支架、摆臂右前安装支架、摆臂右后安装支架、右后车身连接支架、稳定杆右安装支架及转向器右安装支架位于所述右纵梁的上表面；所述右前车身连接支架、摆臂右前安装支架、转向器右安装支架、摆臂右后安装支架及右后车身连接支架由前至后依次排布，所述稳定杆右安装支架在前副车架的左右方向上位于所述摆臂右后安装支架的内侧。",
      "features": [
        {
          "feature_id": "C5-F1",
          "feature_text": "所述左前车身连接支架、摆臂左前安装支架、摆臂左后安装支架、左后车身连接支架、稳定杆左安装支架及转向器左安装支架位于所述左纵梁的上表面；所述左前车身连接支架、摆臂左前安装支架、转向器左安装支架、摆臂左后安装支架及左后车身连接支架由前至后依次排布，所述稳定杆左安装支架在前副车架的左右方向上位于所述摆臂左后安装支架的内侧"
        },
        {
          "feature_id": "C5-F2",
          "feature_text": "所述右前车身连接支架、摆臂右前安装支架、摆臂右后安装支架、右后车身连接支架、稳定杆右安装支架及转向器右安装支架位于所述右纵梁的上表面；所述右前车身连接支架、摆臂右前安装支架、转向器右安装支架、摆臂右后安装支架及右后车身连接支架由前至后依次排布，所述稳定杆右安装支架在前副车架的左右方向上位于所述摆臂右后安装支架的内侧"
        }
      ]
    },
    {
      "claim_no": 6,
      "claim_text": "6.根据权利要求4所述的前副车架，其特征在于，所述左纵梁及右纵梁的壁厚为3.5-4.5mm，且所述左纵梁及右纵梁上形成有多个砂芯孔。",
      "features": [
        {
          "feature_id": "C6-F1",
          "feature_text": "所述左纵梁及右纵梁的壁厚为3.5-4.5mm"
        },
        {
          "feature_id": "C6-F2",
          "feature_text": "且所述左纵梁及右纵梁上形成有多个砂芯孔"
        }
      ]
    },
    {
      "claim_no": 7,
      "claim_text": "7.根据权利要求4所述的前副车架，其特征在于，所述左纵梁及右纵梁的前端均设置有用于吸能盒安装的吸能盒安装孔，且所述左纵梁及右纵梁的前端以截面越来越小的方式向前凸出。",
      "features": [
        {
          "feature_id": "C7-F1",
          "feature_text": "所述左纵梁及右纵梁的前端均设置有用于吸能盒安装的吸能盒安装孔，且所述左纵梁及右纵梁的前端以截面越来越小的方式向前凸出"
        }
      ]
    },
    {
      "claim_no": 8,
      "claim_text": "8.根据权利要求4所述的前副车架，其特征在于，所述左纵梁上对应所述稳定杆左安装支架的位置在一体成型所述左纵梁总成时预埋有第一螺母，所述右纵梁上对应所述稳定杆右安装支架的位置在一体成型所述右纵梁总成时预埋有第二螺母。",
      "features": [
        {
          "feature_id": "C8-F1",
          "feature_text": "所述左纵梁上对应所述稳定杆左安装支架的位置在一体成型所述左纵梁总成时预埋有第一螺母"
        },
        {
          "feature_id": "C8-F2",
          "feature_text": "所述右纵梁上对应所述稳定杆右安装支架的位置在一体成型所述右纵梁总成时预埋有第二螺母"
        }
      ]
    },
    {
      "claim_no": 9,
      "claim_text": "9.根据权利要求1所述的前副车架，其特征在于，所述左纵梁的前端朝向所述前横梁延伸形成前横梁左连接管，所述右纵梁的前端朝向所述前横梁延伸形成前横梁右连接管，所述前横梁的左端插入所述前横梁左连接管中并搭边焊接，所述前横梁的右端插入所述前横梁右连接管中并搭边焊接；所述左纵梁的后端朝向所述后横梁延伸形成后横梁左连接管，所述右纵梁的后端朝向所述后横梁延伸形成后横梁右连接管，所述后横梁的左端插入所述后横梁左连接管中并搭边焊接，所述后横梁的右端插入所述后横梁右连接管中并搭边焊接。",
      "features": [
        {
          "feature_id": "C9-F1",
          "feature_text": "所述左纵梁的前端朝向所述前横梁延伸形成前横梁左连接管，所述右纵梁的前端朝向所述前横梁延伸形成前横梁右连接管，所述前横梁的左端插入所述前横梁左连接管中并搭边焊接，所述前横梁的右端插入所述前横梁右连接管中并搭边焊接"
        },
        {
          "feature_id": "C9-F2",
          "feature_text": "所述左纵梁的后端朝向所述后横梁延伸形成后横梁左连接管，所述右纵梁的后端朝向所述后横梁延伸形成后横梁右连接管，所述后横梁的左端插入所述后横梁左连接管中并搭边焊接，所述后横梁的右端插入所述后横梁右连接管中并搭边焊接"
        }
      ]
    },
    {
      "claim_no": 10,
      "claim_text": "10.根据权利要求9所述的前副车架，其特征在于，所述前横梁与后横梁均呈矩形，所述前横梁左连接管形成有与所述前横梁的左端插接配合的左前矩形槽，所述前横梁右连接管形成有与所述前横梁的右端插接配合的右前矩形槽，所述后横梁左连接管形成有与所述后横梁的左端插接配合的左后矩形槽，所述后横梁右连接管形成有与所述后横梁的右端插接配合的右后矩形槽。",
      "features": [
        {
          "feature_id": "C10-F1",
          "feature_text": "所述前横梁与后横梁均呈矩形"
        },
        {
          "feature_id": "C10-F2",
          "feature_text": "所述前横梁左连接管形成有与所述前横梁的左端插接配合的左前矩形槽，所述前横梁右连接管形成有与所述前横梁的右端插接配合的右前矩形槽"
        },
        {
          "feature_id": "C10-F3",
          "feature_text": "所述后横梁左连接管形成有与所述后横梁的左端插接配合的左后矩形槽，所述后横梁右连接管形成有与所述后横梁的右端插接配合的右后矩形槽"
        }
      ]
    },
    {
      "claim_no": 11,
      "claim_text": "11.根据权利要求1-10任意一项所述的前副车架，其特征在于，所述前副车架还包括连接在所述前横梁上表面的前悬置安装支架及连接在所述后横梁上表面的后悬置安装支架。",
      "features": [
        {
          "feature_id": "C11-F1",
          "feature_text": "所述前副车架还包括连接在所述前横梁上表面的前悬置安装支架及连接在所述后横梁上表面的后悬置安装支架"
        }
      ]
    },
    {
      "claim_no": 12,
      "claim_text": "12.一种汽车，其特征在于，包括权利要求1-11任意一项所述的前副车架。",
      "features": [
        {
          "feature_id": "C12-F1",
          "feature_text": "一种汽车，其特征在于，包括权利要求1-11任意一项所述的前副车架"
        }
      ]
    }
  ],
  "claim_1_text": "1.一种前副车架，其特征在于，包括左纵梁总成、右纵梁总成、前横梁及后横梁，所述左纵梁总成包括左纵梁及与所述左纵梁一体成型的多个左侧安装支架，所述右纵梁总成包括右纵梁及与所述右纵梁一体成型的多个右侧安装支架，所述前横梁的左端与所述左纵梁的前端连接，所述前横梁的右端与所述右纵梁的前端连接，所述后横梁的左端与所述左纵梁的后端连接，所述后横梁的右端与所述右纵梁的后端连接。",
  "claim_1_features": [
    {
      "feature_id": "C1-F1",
      "feature_text": "一种前副车架"
    },
    {
      "feature_id": "C1-F2",
      "feature_text": "包括左纵梁总成、右纵梁总成、前横梁及后横梁"
    },
    {
      "feature_id": "C1-F3",
      "feature_text": "所述左纵梁总成包括左纵梁及与所述左纵梁一体成型的多个左侧安装支架"
    },
    {
      "feature_id": "C1-F4",
      "feature_text": "所述右纵梁总成包括右纵梁及与所述右纵梁一体成型的多个右侧安装支架"
    },
    {
      "feature_id": "C1-F5",
      "feature_text": "所述前横梁的左端与所述左纵梁的前端连接，所述前横梁的右端与所述右纵梁的前端连接"
    },
    {
      "feature_id": "C1-F6",
      "feature_text": "所述后横梁的左端与所述左纵梁的后端连接，所述后横梁的右端与所述右纵梁的后端连接"
    }
  ],
  "technology_tag": "车身与底盘",
  "claims_source": "html"
}
