{
  "patent": {
    "publication_no": "CN207140992U",
    "country_code": "CN",
    "title": "前保险杠安装结构及汽车",
    "applicants": [
      "BYD Co Ltd"
    ],
    "inventors": [
      "华龙",
      "刘伟强",
      "何深凤",
      "苏久盛"
    ],
    "application_date": "2017-08-10",
    "google_patents_url": "https://patents.google.com/patent/CN207140992U/zh",
    "pdf_url": "https://patentimages.storage.googleapis.com/92/35/55/e19b2acea91dfd/CN207140992U.pdf"
  },
  "claims": [
    {
      "claim_no": 1,
      "claim_text": "1.一种前保险杠安装结构，其特征在于，包括前保险杠、前保险杠安装支架及翼子板，所述前保险杠的上侧向后翻折形成前保险杠内翻边，所述翼子板的下侧向后翻折形成翼子板内翻边，所述前保险杠安装支架固定连接在所述翼子板内翻边的下方，所述前保险杠内翻边与所述前保险杠安装支架卡接。",
      "features": [
        {
          "feature_id": "C1-F1",
          "feature_text": "一种前保险杠安装结构"
        },
        {
          "feature_id": "C1-F2",
          "feature_text": "包括前保险杠、前保险杠安装支架及翼子板"
        },
        {
          "feature_id": "C1-F3",
          "feature_text": "所述前保险杠的上侧向后翻折形成前保险杠内翻边"
        },
        {
          "feature_id": "C1-F4",
          "feature_text": "所述翼子板的下侧向后翻折形成翼子板内翻边"
        },
        {
          "feature_id": "C1-F5",
          "feature_text": "所述前保险杠安装支架固定连接在所述翼子板内翻边的下方"
        },
        {
          "feature_id": "C1-F6",
          "feature_text": "所述前保险杠内翻边与所述前保险杠安装支架卡接"
        }
      ]
    },
    {
      "claim_no": 2,
      "claim_text": "2.根据权利要求1所述的前保险杠安装结构，其特征在于，所述前保险杠内翻边与所述前保险杠安装支架在前后方向上卡接。",
      "features": [
        {
          "feature_id": "C2-F1",
          "feature_text": "所述前保险杠内翻边与所述前保险杠安装支架在前后方向上卡接"
        }
      ]
    },
    {
      "claim_no": 3,
      "claim_text": "3.根据权利要求1所述的前保险杠安装结构，其特征在于，所述前保险杠内翻边上设置有至少一个卡孔，所述前保险杠安装支架的前侧设置有至少一个卡脚，所述卡脚卡入对应的所述卡孔内。",
      "features": [
        {
          "feature_id": "C3-F1",
          "feature_text": "所述前保险杠内翻边上设置有至少一个卡孔"
        },
        {
          "feature_id": "C3-F2",
          "feature_text": "所述前保险杠安装支架的前侧设置有至少一个卡脚，所述卡脚卡入对应的所述卡孔内"
        }
      ]
    },
    {
      "claim_no": 4,
      "claim_text": "4.根据权利要求1所述的前保险杠安装结构，其特征在于，所述前保险杠安装支架上设置有自攻螺钉座，所述翼子板内翻边上设置有安装孔，所述自攻螺钉座向上穿出所述安装孔，所述前保险杠安装结构还包括由下至上插接在所述自攻螺钉座内的自攻螺钉，所述自攻螺钉向外挤压所述自攻螺钉座以使得自攻螺钉座过盈压装在所述安装孔内。",
      "features": [
        {
          "feature_id": "C4-F1",
          "feature_text": "所述前保险杠安装支架上设置有自攻螺钉座，所述翼子板内翻边上设置有安装孔，所述自攻螺钉座向上穿出所述安装孔"
        },
        {
          "feature_id": "C4-F2",
          "feature_text": "所述前保险杠安装结构还包括由下至上插接在所述自攻螺钉座内的自攻螺钉，所述自攻螺钉向外挤压所述自攻螺钉座以使得自攻螺钉座过盈压装在所述安装孔内"
        }
      ]
    },
    {
      "claim_no": 5,
      "claim_text": "5.根据权利要求4所述的前保险杠安装结构，其特征在于，所述前保险杠安装结构还包括翼子板加强板，所述翼子板加强板包括与所述翼子板内翻边搭边连接的第一翻边及连接在所述第一翻边后侧的第二翻边；所述前保险杠安装支架上设置有螺栓安装座，所述螺栓安装座上设置有螺栓安装孔，所述第一翻边的上部固定设置有一螺母，所述前保险杠安装结构还包括由下至上穿过所述螺栓安装孔的螺栓，所述螺栓的上端旋入所述螺母。",
      "features": [
        {
          "feature_id": "C5-F1",
          "feature_text": "所述前保险杠安装结构还包括翼子板加强板，所述翼子板加强板包括与所述翼子板内翻边搭边连接的第一翻边及连接在所述第一翻边后侧的第二翻边"
        },
        {
          "feature_id": "C5-F2",
          "feature_text": "所述前保险杠安装支架上设置有螺栓安装座，所述螺栓安装座上设置有螺栓安装孔"
        },
        {
          "feature_id": "C5-F3",
          "feature_text": "所述第一翻边的上部固定设置有一螺母"
        },
        {
          "feature_id": "C5-F4",
          "feature_text": "所述前保险杠安装结构还包括由下至上穿过所述螺栓安装孔的螺栓，所述螺栓的上端旋入所述螺母"
        }
      ]
    },
    {
      "claim_no": 6,
      "claim_text": "6.根据权利要求5所述的前保险杠安装结构，其特征在于，所述前保险杠安装支架上设置有两个所述自攻螺钉座，所述螺栓安装座位于所述两个所述自攻螺钉座的中间位置。",
      "features": [
        {
          "feature_id": "C6-F1",
          "feature_text": "所述前保险杠安装支架上设置有两个所述自攻螺钉座，所述螺栓安装座位于所述两个所述自攻螺钉座的中间位置"
        }
      ]
    },
    {
      "claim_no": 7,
      "claim_text": "7.根据权利要求5所述的前保险杠安装结构，其特征在于，所述第一翻边沿水平方向向后延伸，所述第二翻边由所述第一翻边的后侧边缘向下倾斜延伸。",
      "features": [
        {
          "feature_id": "C7-F1",
          "feature_text": "所述第一翻边沿水平方向向后延伸"
        },
        {
          "feature_id": "C7-F2",
          "feature_text": "所述第二翻边由所述第一翻边的后侧边缘向下倾斜延伸"
        }
      ]
    },
    {
      "claim_no": 8,
      "claim_text": "8.根据权利要求1所述的前保险杠安装结构，其特征在于，所述前保险杠内翻边沿水平方向向后延伸。",
      "features": [
        {
          "feature_id": "C8-F1",
          "feature_text": "所述前保险杠内翻边沿水平方向向后延伸"
        }
      ]
    },
    {
      "claim_no": 9,
      "claim_text": "9.根据权利要求1所述的前保险杠安装结构，其特征在于，所述翼子板内翻边沿水平方向向后延伸。",
      "features": [
        {
          "feature_id": "C9-F1",
          "feature_text": "所述翼子板内翻边沿水平方向向后延伸"
        }
      ]
    },
    {
      "claim_no": 10,
      "claim_text": "10.一种汽车，其特征在于，包括权利要求1-9任意一项所述的前保险杠安装结构。",
      "features": [
        {
          "feature_id": "C10-F1",
          "feature_text": "一种汽车，包括前保险杠安装结构"
        }
      ]
    }
  ],
  "claim_1_text": "1.一种前保险杠安装结构，其特征在于，包括前保险杠、前保险杠安装支架及翼子板，所述前保险杠的上侧向后翻折形成前保险杠内翻边，所述翼子板的下侧向后翻折形成翼子板内翻边，所述前保险杠安装支架固定连接在所述翼子板内翻边的下方，所述前保险杠内翻边与所述前保险杠安装支架卡接。",
  "claim_1_features": [
    {
      "feature_id": "C1-F1",
      "feature_text": "一种前保险杠安装结构"
    },
    {
      "feature_id": "C1-F2",
      "feature_text": "包括前保险杠、前保险杠安装支架及翼子板"
    },
    {
      "feature_id": "C1-F3",
      "feature_text": "所述前保险杠的上侧向后翻折形成前保险杠内翻边"
    },
    {
      "feature_id": "C1-F4",
      "feature_text": "所述翼子板的下侧向后翻折形成翼子板内翻边"
    },
    {
      "feature_id": "C1-F5",
      "feature_text": "所述前保险杠安装支架固定连接在所述翼子板内翻边的下方"
    },
    {
      "feature_id": "C1-F6",
      "feature_text": "所述前保险杠内翻边与所述前保险杠安装支架卡接"
    }
  ],
  "technology_tag": "车身与底盘",
  "claims_source": "html"
}
