{
  "patent": {
    "publication_no": "CN221477024U",
    "country_code": "CN",
    "title": "侧气囊、座椅系统及车辆",
    "applicants": [
      "比亚迪股份有限公司"
    ],
    "inventors": [
      "蒋浩",
      "杜群",
      "王美松",
      "程怡春",
      "张海岸"
    ],
    "application_date": "2023-12-29",
    "google_patents_url": "https://patents.google.com/patent/CN221477024U/zh",
    "pdf_url": "https://patentimages.storage.googleapis.com/6f/45/f0/f6dabd2e1b0e3c/CN221477024U.pdf"
  },
  "claims": [
    {
      "claim_no": 1,
      "claim_text": "1.一种侧气囊，应用于车辆，适于折叠并安装于车辆座椅的一侧，其特征在于，包括： 气袋，包括第一袋面和第二袋面，所述第一袋面的周沿与所述第二袋面的周沿密封连接形成所述气袋；以及 气体发生器，设置于所述第一袋面上；所述气体发生器用于向所述气袋充气，以使所述气袋膨胀。",
      "features": [
        {
          "feature_id": "C1-F1",
          "feature_text": "一种侧气囊，应用于车辆，适于折叠并安装于车辆座椅的一侧"
        },
        {
          "feature_id": "C1-F2",
          "feature_text": "气袋，包括第一袋面和第二袋面，所述第一袋面的周沿与所述第二袋面的周沿密封连接形成所述气袋"
        },
        {
          "feature_id": "C1-F3",
          "feature_text": "气体发生器，设置于所述第一袋面上；所述气体发生器用于向所述气袋充气，以使所述气袋膨胀"
        }
      ]
    },
    {
      "claim_no": 2,
      "claim_text": "2.如权利要求1所述的侧气囊，其特征在于， 所述第一袋面和所述第二袋面对称设置。",
      "features": [
        {
          "feature_id": "C2-F1",
          "feature_text": "所述第一袋面和所述第二袋面对称设置"
        }
      ]
    },
    {
      "claim_no": 3,
      "claim_text": "3.如权利要求2所述的侧气囊，其特征在于， 所述第一袋面和所述第二袋面一体成型，所述第二袋面沿对称线相对于所述第一袋面对折，所述气体发生器与所述对称线间隔设置。",
      "features": [
        {
          "feature_id": "C3-F1",
          "feature_text": "所述第一袋面和所述第二袋面一体成型，所述第二袋面沿对称线相对于所述第一袋面对折"
        },
        {
          "feature_id": "C3-F2",
          "feature_text": "所述气体发生器与所述对称线间隔设置"
        }
      ]
    },
    {
      "claim_no": 4,
      "claim_text": "4.如权利要求3所述的侧气囊，其特征在于， 所述气体发生器的轴线方向与所述对称线相平行。",
      "features": [
        {
          "feature_id": "C4-F1",
          "feature_text": "所述气体发生器的轴线方向与所述对称线相平行"
        }
      ]
    },
    {
      "claim_no": 5,
      "claim_text": "5.如权利要求4所述的侧气囊，其特征在于， 所述气体发生器的轴线与所述对称线之间的间距的范围为[50，120]mm。",
      "features": [
        {
          "feature_id": "C5-F1",
          "feature_text": "所述气体发生器的轴线与所述对称线之间的间距的范围为[50，120]mm"
        }
      ]
    },
    {
      "claim_no": 6,
      "claim_text": "6.如权利要求3所述的侧气囊，其特征在于， 所述气体发生器的轴线方向与所述对称线相倾斜。",
      "features": [
        {
          "feature_id": "C6-F1",
          "feature_text": "所述气体发生器的轴线方向与所述对称线相倾斜"
        }
      ]
    },
    {
      "claim_no": 7,
      "claim_text": "7.如权利要求6所述的侧气囊，其特征在于， 所述气体发生器的轴线相对于所述对称线的倾斜角度的范围为[10，30]°。",
      "features": [
        {
          "feature_id": "C7-F1",
          "feature_text": "所述气体发生器的轴线相对于所述对称线的倾斜角度的范围为[10，30]°"
        }
      ]
    },
    {
      "claim_no": 8,
      "claim_text": "8.如权利要求7所述的侧气囊，其特征在于， 所述气体发生器靠近所述对称线的一端与所述对称线之间的间距的范围为[0，130]mm，所述气体发生器远离所述对称线的一端与所述对称线之间的间距的范围为[60，190]mm。",
      "features": [
        {
          "feature_id": "C8-F1",
          "feature_text": "所述气体发生器靠近所述对称线的一端与所述对称线之间的间距的范围为[0，130]mm"
        },
        {
          "feature_id": "C8-F2",
          "feature_text": "所述气体发生器远离所述对称线的一端与所述对称线之间的间距的范围为[60，190]mm"
        }
      ]
    },
    {
      "claim_no": 9,
      "claim_text": "9.如权利要求1所述的侧气囊，其特征在于， 所述第一袋面上设置有装配孔，所述装配孔用于供所述气体发生器穿设，以使至少部分所述气体发生器位于所述气袋内。",
      "features": [
        {
          "feature_id": "C9-F1",
          "feature_text": "所述第一袋面上设置有装配孔，所述装配孔用于供所述气体发生器穿设，以使至少部分所述气体发生器位于所述气袋内"
        }
      ]
    },
    {
      "claim_no": 10,
      "claim_text": "10.如权利要求9所述的侧气囊，其特征在于， 所述第一袋面上设置有固定孔，所述固定孔用于将所述气体发生器固定于车辆的座椅上。",
      "features": [
        {
          "feature_id": "C10-F1",
          "feature_text": "所述第一袋面上设置有固定孔，所述固定孔用于将所述气体发生器固定于车辆的座椅上"
        }
      ]
    },
    {
      "claim_no": 11,
      "claim_text": "11.如权利要求9所述的侧气囊，其特征在于， 所述第一袋面上设置有防呆孔，所述防呆孔为异形孔。",
      "features": [
        {
          "feature_id": "C11-F1",
          "feature_text": "所述第一袋面上设置有防呆孔，所述防呆孔为异形孔"
        }
      ]
    },
    {
      "claim_no": 12,
      "claim_text": "12.如权利要求1所述的侧气囊，其特征在于， 所述第二袋面上具有泄气孔。",
      "features": [
        {
          "feature_id": "C12-F1",
          "feature_text": "所述第二袋面上具有泄气孔"
        }
      ]
    },
    {
      "claim_no": 13,
      "claim_text": "13.一种座椅系统，应用于车辆，其特征在于，包括： 如权利要求1至12任意一项所述的侧气囊；以及 座椅，所述气体发生器安装于所述座椅的靠背上； 所述侧气囊膨胀的过程中，所述气袋的部分能够从驾乘人员的手臂下方伸入，并将驾乘人员的手臂抬起；当所述气袋完全膨胀后，所述气袋的部分位于驾乘人员的手臂下方及胸腹部围成的空间内。",
      "features": [
        {
          "feature_id": "C13-F1",
          "feature_text": "一种座椅系统，应用于车辆"
        },
        {
          "feature_id": "C13-F2",
          "feature_text": "座椅，所述气体发生器安装于所述座椅的靠背上"
        },
        {
          "feature_id": "C13-F3",
          "feature_text": "所述侧气囊膨胀的过程中，所述气袋的部分能够从驾乘人员的手臂下方伸入，并将驾乘人员的手臂抬起；当所述气袋完全膨胀后，所述气袋的部分位于驾乘人员的手臂下方及胸腹部围成的空间内"
        }
      ]
    },
    {
      "claim_no": 14,
      "claim_text": "14.如权利要求13所述的座椅系统，其特征在于， 所述侧气囊处于膨胀状态时，所述第一袋面和所述第二袋面之间的连接线部分位于驾乘人员的手臂下方及胸腹部围成的空间内。",
      "features": [
        {
          "feature_id": "C14-F1",
          "feature_text": "所述侧气囊处于膨胀状态时，所述第一袋面和所述第二袋面之间的连接线部分位于驾乘人员的手臂下方及胸腹部围成的空间内"
        }
      ]
    },
    {
      "claim_no": 15,
      "claim_text": "15.一种车辆，其特征在于，包括： 如权利要求13或14任意一项所述的座椅系统；以及 车身，所述座椅安装于所述车身内。",
      "features": [
        {
          "feature_id": "C15-F1",
          "feature_text": "一种车辆"
        },
        {
          "feature_id": "C15-F2",
          "feature_text": "车身，所述座椅安装于所述车身内"
        }
      ]
    },
    {
      "claim_no": 16,
      "claim_text": "16.如权利要求15所述的车辆，其特征在于， 所述侧气囊安装于所述座椅靠近所述车身的一侧。",
      "features": [
        {
          "feature_id": "C16-F1",
          "feature_text": "所述侧气囊安装于所述座椅靠近所述车身的一侧"
        }
      ]
    }
  ],
  "claim_1_text": "1.一种侧气囊，应用于车辆，适于折叠并安装于车辆座椅的一侧，其特征在于，包括： 气袋，包括第一袋面和第二袋面，所述第一袋面的周沿与所述第二袋面的周沿密封连接形成所述气袋；以及 气体发生器，设置于所述第一袋面上；所述气体发生器用于向所述气袋充气，以使所述气袋膨胀。",
  "claim_1_features": [
    {
      "feature_id": "C1-F1",
      "feature_text": "一种侧气囊，应用于车辆，适于折叠并安装于车辆座椅的一侧"
    },
    {
      "feature_id": "C1-F2",
      "feature_text": "气袋，包括第一袋面和第二袋面，所述第一袋面的周沿与所述第二袋面的周沿密封连接形成所述气袋"
    },
    {
      "feature_id": "C1-F3",
      "feature_text": "气体发生器，设置于所述第一袋面上；所述气体发生器用于向所述气袋充气，以使所述气袋膨胀"
    }
  ],
  "technology_tag": "车身与底盘",
  "claims_source": "html"
}
